Word,Meaning,POS,Phonetic,Example,Translation,Note,Unit
comment,评论,动,ˈkɒmɛnt,The professor made insightful comments on my thesis draft.,教授对我的论文草稿提出了很有见地的意见。,【其他—名】,15
encourage,鼓励,动,ɪnˈkʌrɪʤ,Teachers always encourage students to express their ideas freely.,教师总是鼓励学生自由表达自己的想法。,【固】encourage sb. to do … 鼓励某人做…；【名】encouragement,15
engage,参与，从事,动,ɪnˈɡeɪʤ,Teachers aim to engage students in dynamic learning experiences.,教师的目标是让学生参与充满活力的学习体验。,【固】engage in 参与、从事， engage with 与...交往、交流 【名】engagement 参与,15
occupation,职业,名,ˌɒkjəˈpeɪʃᵊn,Teaching is not just an occupation; it's a profession that shapes future generations.,教师不仅是一种职业，更是一种塑造后代的职业。,,15
tutorial,教程辅导材料,名,tjuːˈtɔːriəl,The tutorial provides step-by-step instructions for the software.,教程提供了软件的分步说明。,,15
transaction,交易,名,trænˈzækʃᵊn,The transaction was completed successfully.,交易完成得十分顺利。,【动】transact 转账,15
even,均衡，相等的,形,ˈiːvᵊn,The balance was even at the end of the transaction.,交易结束时，余额持平。,【其他—副】甚至,15
transportation,移动手段，交通机关,名,ˌtrænspɔːˈteɪʃᵊn,Transportation is crucial for a nation's economic development.,交通对于一个国家的经济发展至关重要。,【动/名】transport 运输,15
recipient,接受方，接收人，收件人,名,rɪˈsɪpiənt,The scholarship recipient was honored at the ceremony.,奖学金获得者在颁奖仪式上接受表彰。,,15
fold,折叠,动,fəʊld,Fold the paper in half to create the booklet.,将纸对折，制作成小册子。,,15
considering,考虑到，鉴于,介,kənˈsɪdərɪŋ,Considering his experience he was the ideal candidate.,鉴于到他的经验，他是理想的人选。,【动】consider 考虑,15
trainer,教练员，培训师,名,ˈtreɪnə,The fitness trainer designs personalized workout plans.,健身教练可以设计个性化的锻炼计划。,【其他词义】跑步鞋,15
sporting,运动的,形,ˈspɔːtɪŋ,The gym offers a variety of sporting activities.,健身房提供各种体育活动。,,15
consist,组成,动,kənˈsɪst,A healthy diet should consist of a variety of food.,健康饮食应包括各种食物。,【名】consistency 一致性,15
project,企划，计划,名,ˈprɒʤɛkt,The construction project is underway downtown.,建筑项目正在市中心进行。,【其他—动】【音】投射 /prəˈdʒɛkt/,15
phase,阶段，时期,名,feɪz,The construction project is in its final phase.,建筑项目已进入最后阶段。,,15
completion,完成,名,kəmˈpliːʃᵊn,The completion of the construction project is scheduled for next month.,建筑项目计划于下个月完工。,,15
architect,建筑师,名,ˈɑːkɪtɛkt,The architect presented a modern design for the new building.,建筑师为新建筑设计了现代风格。,【名】architecture 建筑,15
vision,构想，视界,名,ˈvɪʒᵊn,The architect had a unique vision for the building design.,建筑师对建筑设计有独特的见解。,,15
timber,木材,名,ˈtɪmbə,The construction company sourced timber from sustainable forests for their projects.,建筑公司为其项目从可持续森林中采购木材。,,15
feedback,反馈，意见,名,ˈfiːdbæk,Constructive feedback helps improve performance.,建设性的反馈有助于提高绩效。,,15
connection,联系,名,kəˈnɛkʃᵊn,Building a strong professional connection is essential for career growth ,建立强大的专业联系对职业发展至关重要 ,,15
concise,简洁的，精炼的,形,kənˈsaɪs,Keep your resume concise and only highlight key achievements and qualifications.,简历要简明扼要，突出主要成就和资历。,,15
spending,支出，花费,名,ˈspɛndɪŋ,Her spending habits changed after the budget review.,检查过自己的预算后，她的消费习惯发生了变化。,,15
consistency,一致性,名,kənˈsɪstᵊnsi,The consistency of workout routines is key to achieving fitness goals.,坚持锻炼是实现健身目标的关键。,,15
vary,变化,动,ˈveəri,Prices may vary depending on the product's features.,价格可能因产品功能而异。,【形】varying 多种多样的；变化的,15
household,家庭，一家人,名,ˈhaʊshəʊld,Household chores were divided among the family members.,家务活由家庭成员分担。,,15
resistant,耐...的,形,rɪˈzɪstᵊnt,The jacket is resistant to water and is suitable for rainy weather.,夹克具有防水功能，适合雨天穿着。,【固】heat-resistant 耐热的， wrinkle-resistant 抗皱的,15
membership,会员资格,名,ˈmɛmbəʃɪp,Membership in the club comes with exclusive benefits.,加入俱乐部即可享受专属优惠。,,15
technical,技术上的,形,ˈtɛknɪkᵊl,The technical team maintains the company's computer systems.,技术团队负责维护公司的计算机系统。,,15
technician,技术人员,名,tɛkˈnɪʃᵊn,The technician repaired the computer within an hour.,技术人员在一小时内就修好了电脑。,,15
repair,修理,动,rɪˈpeə,The technician will repair the malfunctioning equipment by tomorrow.,技术人员将在明天之前修复出现故障的设备。,,15
revolution,革命,名,ˌrɛvəˈluːʃᵊn,The technological revolution has transformed the way we live and work.,技术革命改变了我们的生活和工作方式。,,15
rapidly,迅速地,副,ˈræpɪdli,Technology is rapidly advancing and shaping the future of industries.,技术发展日新月异，塑造着各行各业的未来。,【形】rapid 快速的,15
component,成分， 部件， 组成部分,名,kəmˈpəʊnənt,Each component of the computer contributes to its overall performance.,计算机的每个组件都对其整体性能做出了贡献。,,15
aspect,方面，层面,名,ˈæspɛkt,Every aspect of the plan was carefully considered.,计划的方方面面都经过了仔细考虑。,,15
foundation,基础，基金会，财团,名,faʊnˈdeɪʃᵊn,The foundation supports educational initiatives.,基金会支持教育活动。,【动】found 创立,15
debt,债务,名,dɛt,Accumulating significant debt can have long-term financial consequences.,积累巨额债务会带来长期的财务后果。,【固】be in debt 负债 ,15
reinforce,加强,动,ˌriːɪnˈfɔːs,Positive feedback can reinforce desirable behaviors in the workplace.,积极的反馈可以强化工作场所中的理想行为。,,15
outcome,结果,名,ˈaʊtkʌm,The positive outcome exceeded expectations.,积极成果超出预期。,【注】inome 收入,15
mechanic,技工，机械师,名,məˈkænɪk,The mechanic fixed the car's engine quickly.,机械师很快就修好了汽车的发动机。,,15
fix,修理；解决,动,fɪks,The mechanic was able to quickly fix the engine issue.,机械师很快就修好了发动机。,,15
shipment,发送，运送的货品,名,ˈʃɪpmənt,The shipment of goods arrived on time.,货物准时到达。,,15
flyer,传单,名,ˈflaɪə,The event organizer distributed a colorful flyer.,活动组织者分发了彩色传单。,,15
formal,正式的,形,ˈfɔːmᵊl,The event calls for formal attire.,活动要求着正装。,【反】informal 非正式的,15
mailing,邮件，邮寄,名,ˈmeɪlɪŋ,The mailing of the invitations for the event will be completed by the end of the week.,活动邀请函的邮寄工作将在本周末完成。,,15
planner,计划者，企划者,名,ˈplænə,The event planner organized a successful conference.,活动策划人成功组织了一次会议。,,15
pavilion,华美的建筑，运动场看台，亭,名,pəˈvɪljən,The wedding reception took place in a beautiful pavilion surrounded by gardens and trees.,婚宴在花园和树木环绕的美丽亭子中举行。,,15
venue,会场,名,ˈvɛnjuː,The wedding venue was decorated beautifully.,婚礼场地布置得非常漂亮。,,15
expire,过期,动,ɪkˈspaɪə,The membership card will expire at the end of the month.,会员卡将在本月底到期。,【名】expiration 有效期,15
confidential,机密的,形,ˌkɒnfɪˈdɛnʃᵊl,All discussions in the meeting are confidential.,会议中讨论的所有内容都是保密的。,,15
agenda,议程,名,əˈʤɛndə,The meeting's agenda included several important topics.,会议议程中有几个重要议题。,,15
related,与…相关的,动,rɪˈleɪtɪd,The issues discussed in the meeting were not directly related to the project.,会议讨论的问题与项目没有直接关系。,【固】be related to 与…相关,15
throughout,自始至终，贯穿,介,θruːˈaʊt,The conference room was booked throughout the week.,会议室整周都被预订了。,,15
occupied,被占用的，忙碌的,形,ˈɒkjəpaɪd,The room was occupied so we had to find an alternative space for the meeting.,会议室已被占用，因此我们不得不另找地方开会。,,16
crucial,至关重要的,形,ˈkruːʃᵊl,A crucial decision was made at the meeting.,会议上做出了一项重要决定。,,16
comprehensive,综合的,形容,ˌkɒmprɪˈhɛnsɪv,A comprehensive review of the research findings was presented during the conference.,会议期间对研究成果进行了全面回顾。,【动】comprehend 理解，领会,16
moderator,主持人,名,ˈmɒdəreɪtə,The moderator guided the discussion during the meeting.,会议期间，主持人引导大家进行讨论。,,16
compliment,赞扬,名,ˈkɒmplɪmənt,She received a compliment on her well-prepared presentation during the meeting.,会议期间，她准备充分的演讲得到了称赞。,,16
disturb,打扰,动,dɪˈstɜːb,Please do not disturb the occupants while the meeting is in progress.,会议进行中，请勿打扰室内人员。,【名】disturbance 干扰,16
immediately,立即地，马上地,副,ɪˈmiːdiətli,He left immediately after the meeting.,会议结束后他就离开了。,【形】immediate,16
maximum,最大量，最大限,名,ˈmæksɪməm,The maximum capacity of the venue is 500 people.,会场最多可容纳 500 人。,【反】minimum 最小量,16
compost,堆肥,名,ˈkɒmpɒst,Recycling kitchen waste to create compost contributes to sustainable living.,回收厨房垃圾制作堆肥有助于实现可持续生活。,,16
retrospective,回顾的，追溯的,形,ˌrɛtrəʊˈspɛktɪv,The retrospective analysis revealed patterns that were not apparent at the time.,回顾性分析揭示了当时并不明显的模式。,,16
concern,顾虑，担心,名,kənˈsɜːn,Environmental pollution is a major concern for the community.,环境污染是社会关注的焦点。,【其他—动】关于，牵涉,16
reduce,减少,动,rɪˈdjuːs,Environmental initiatives aim to reduce the company's carbon footprint.,环保措施旨在减少公司的碳足迹。,【名】 reduction,16
artwork,艺术品,名,ˈɑːtˌwɜːk,The gallery showcased beautiful artwork from local artists.,画廊展示了当地艺术家的精美艺术品。,,16
walkway,过道，走廊,名,ˈwɔːkweɪ,The garden has a beautiful walkway with flowers on the sides.,花园里有一条美丽的人行道，两边种满了鲜花。,,16
provider,提供者，供应商,名,prəˈvaɪdə,The internet provider offers high-speed connections.,互联网提供商提供高速的网络连接。,【动】provide,16
revolutionary,革命的,形,ˌrɛvəˈluːʃᵊnᵊri,The invention of the internet was a revolutionary development in communication.,互联网的发明是通信领域的一次革命性发展。,,16
inn,小旅馆，客栈，小酒店,名,ɪn,The small inn by the lake offers a cozy stay.,湖边的小旅馆提供舒适的住宿环境。,,16
ignore,忽略,动,ɪɡˈnɔː,It's not wise to ignore warning signs of potential hazards in the workplace.,忽视工作场所潜在危险的警示信号是不明智的。,,16
candidate,候选者,名,ˈkændɪˌdeɪt,The candidate presented his vision for the future.,候选人展示了他未来的愿景。,,16
native,本国的,形,ˈneɪtɪv,The red fox is native to North America where it has adapted to various habitats across the continent.,红狐狸原产于北美洲，在那里适应了整个大陆的各种栖息地。,,16
struggle,奋斗，挣扎,动,ˈstrʌɡᵊl,Many students struggle with essay writing.,很多学生在论文写作方面都很吃力。,【其他—名】,16
enroll,登记，入学,动,ɪnˈrəʊl,Many students enroll in online courses for flexibility.,很多学生都会选择在线课程，这样更灵活。,【名】AmE enrollment/ BrE enrolment,16
dairy,乳制品的,形,ˈdeəri,Many people prefer dairy alternatives like almond milk.,很多人喜欢杏仁奶等乳制品替代品。,,16
unused,未使用的,形,ʌnˈjuːst,The items in the box are unused and brand new.,盒子里的物品都是全新未使用过的。,,16
renew,更新,动,rɪˈnjuː,The contract was renewed for another year with updated terms.,合同续签了一年，并更新了条款。,【名】renewal 更新,16
reasonable,合乎情理的，公道的,形,ˈriːzᵊnəbᵊl,The terms of the contract are reasonable and fair for both parties.,合同条款对双方都是合理公平的。,,16
enhance,提高，增进,动,ɪnˈhɑːns,Proper lighting can enhance the ambiance of a room.,合适的照明可以提升房间的氛围。,【名】enhancement,16
shuttle,穿梭，往返,动,ˈʃʌtᵊl,The space agency launched a shuttle to transport astronauts to the International Space Station.,航天局发射了一架航天飞机，将宇航员送往国际空间站。,【固】shuttle bus 摆渡车,16
baggage,行李,名,ˈbæɡɪʤ,The airline lost his baggage during the flight.,航空公司在飞行途中丢失了他的行李。,,16
depart,出发,动,dɪˈpɑːt,The flight is scheduled to depart at dawn.,航班定于黎明起飞。,【名】departure,16
terminal,终点，航站楼,名,ˈtɜːmɪnᵊl,The flight departs from the international terminal.,航班从国际航站楼起飞。,,16
ocean,海洋,名,ˈəʊʃᵊn,The ocean's waves crashed against the sandy shore.,海浪拍打着沙岸。,,16
remainder,剩余物,名,rɪˈmeɪndə,Only a small remainder of the snacks was left after the kids shared it.,孩子们分享完零食后，只剩下了一小部分。,,16
target,目标,名,ˈtɑːɡɪt,The advertising campaign aims to target a specific demographic for maximum impact.,广告活动的目标是针对特定人群，以产生最大影响。,,16
regarding,关于...的,动,rɪˈɡɑːdɪŋ,We will respond to you regarding your inquiry.,关于您的询问，我们将尽快给您答复。,,16
checkout,超市付款台，旅馆结账离开的时间,名,ˈʧəkˈaʊt,Customers proceed to checkout after selecting items for purchase.,顾客在选择要购买的商品后进入结账环节。,,16
satisfaction,满足,名,ˌsætɪsˈfækʃᵊn,Customer satisfaction is a priority for the business.,顾客满意是企业的首要任务。,【动】satisfy 满足；【形】satisfactory 满足的,16
rate,评价,动,reɪt,Customers can rate their experience on the satisfaction survey.,顾客可以在满意度调查中对自己的体验进行评分。,【其他—名】价格,16
index,指数,名,ˈɪndɛks,The stock market index is a measure of the overall performance of the market.,股市指数是衡量市场整体表现的指标。,,16
object,物体,名,ˈɒbʤɪkt,The antique shop displayed a fascinating object from the 19th century.,古董店里陈列着的物品来自十九世纪，十分迷人。,【其他—动】【音】object /əbˈdʒɛkt/【固】object to,16
shopper,购物者，顾客,名,ˈʃɒpə,The shopper explored different stores in the mall.,购物者逛了商场里不同的商店。,,16
specification,规范，规格，明细,名,ˌspɛsɪfɪˈkeɪʃᵊn,Always check the product specification before buying.,购买前一定要检查产品规格。,,16
loyal,忠实的,形,ˈlɔɪəl,Dogs are loyal.,狗是忠诚的。,【名】loyalty 忠诚，忠实,16
supplier,供应商,名,səˈplaɪə,The supplier sees to it that materials be delivered to the construction site on time.,供应商负责将材料准时送到施工现场。,,16
recreation,娱乐,名,ˌrɛkriˈeɪʃᵊn,Parks provide spaces for outdoor recreation activities.,公园为户外娱乐活动提供了场所。,,16
far,遥远的,形,fɑː,The park is not far from here.,公园离这里不远。,,16
utility,公共事业(电/水/瓦斯) ，有用性,名,juːˈtɪləti,The utility company supplies electricity and water to the community.,公用事业公司为社区提供水电。,,16
revenue,收入，收益,名,ˈrɛvɪnjuː,The company's revenue increased after a recently launched campaign.,公司最近开展了一项宣传活动，收益随之增加。,,16
president,总统，主席，校长，董事长,名,ˈprɛzɪdᵊnt,The company's president will attend the conference.,公司总裁将出席会议。,,16
headquarters,总部,名,ˈhɛdˈkwɔːtəz,The company's headquarters is located in the heart of the city.,公司总部位于市中心。,,16
specialize,专攻于…,动,ˈspɛʃəlaɪz,The company specializes in innovative technology.,公司专注于创新技术。,,16
primarily,主要地,副,ˈpraɪmərɪli,The company primarily focuses on sustainable practices.,公司主要关注于可持续发展的商业实践。,【形】primary,16
transition,过渡,名,trænˈzɪʃᵊn,The company is undergoing a smooth transition to new management.,公司正在顺利过渡到新的管理层。,,16
allocate,分配,动,ˈæləʊkeɪt,Companies allocate resources strategically to optimize efficiency and productivity.,公司战略性地分配资源，以优化效率和生产力。,,16
press,出版社，新闻界，报刊,名,prɛs,The company released its new design in the press conference.,公司在新闻发布会上发布了新设计。,【其他—动】按压,16
substantial,大量的，重大的,形,səbˈstænʃᵊl,The company experienced substantial growth in the last quarter.,公司在上一季度实现了大幅增长。,【近】considerable 可观的,16
nationwide,全国范围,副,ˌneɪʃᵊnˈwaɪd,The company operates nationwide.,公司在全国范围内开展业务。,【音】AmE /ˈneɪʃənˌwaɪd/；【其他—形】,16
legal,与法律有关的，合法的,形,ˈliːɡᵊl,Companies are obliged to engage in legal practice.,公司有义务合法地进行商业实践。,,16
network,网络，人际网,名,ˈnɛtwɜːk,The company has a strong professional network.,公司拥有强大的专家团队。,,16
terminate,终止,动,ˈtɜːmɪneɪt,The company had to terminate the employee's contract due to consistent performance issues.,公司因该员工的一贯表现问题而不得不终止其合同。,【易混】terminal 航站楼,16
moving,动人的，令人感动的，移动的，运动的,形,ˈmuːvɪŋ,The company is moving to a larger office space.,公司要搬到一个更大的办公场所。,,16
regulation,规则，规律,名,ˌrɛɡjəˈleɪʃᵊn,The company follows a strict routine safety checklist.,公司严格遵守例行安全检查清单。,【动】regulate 监管,16
corporation,企业,名,ˌkɔːpᵊrˈeɪʃᵊn,The corporation announced its expansion plans.,公司宣布了扩张计划。,,16
supply,提供，供给,动,səˈplaɪ,The company needs a steady source of supply of raw materials.,公司需要稳定的原材料供应来源。,【其他—名】,16
expansion,扩张，扩大,名,ɪksˈpænʃᵊn,The company's expansion into new markets was a strategic move.,公司向新市场扩张是一项战略举措。,【动】expand 扩张,17
invitation,邀请函，招待状,名,ˌɪnvɪˈteɪʃᵊn,An invitation to the company's annual gala was extended to all employees.,公司向所有员工发出了参加公司年度晚会的邀请。,【动】invite 邀请,17
annual,年度的,形,ˈænjuəl,The company hosts an annual conference for its employees.,公司为员工举办年度会议。,,17
bid,投标,名,bɪd,The company placed a bid for the new project.,公司为新项目投标。,,17
transport,运输,名,ˈtrænspɔːt,The company invested in a fleet of electric vehicles to transport goods more sustainably.,公司投资组建了一支电动车队，以更可持续的方式运输货物。,,17
sponsor,赞助商,名,ˈspɒnsə,The company agreed to sponsor the local sports team.,公司同意赞助当地运动队。,,17
personalized,个性化,形,ˈpɜːsᵊnᵊlaɪzd,The company offers personalized services to tailor experiences to each customer.,公司提供个性化服务，为每位客户量身定制体验。,【动】customize 定制,17
CEO,首席执行官,名,siː-iː-əʊ,The CEO of the company announced a new strategic plan for growth.,公司首席执行官宣布了新的发展战略计划。,【注】chief executive officer的缩写,17
division,部门，区分,名,dɪˈvɪʒᵊn,The company has a separate division for marketing.,公司设有单独的营销部门。,【近】department 部门,17
appoint,任命；确定时间/地点,动,əˈpɔɪnt,The company appointed him as the new CEO.,公司任命他为新任首席执行官。,【名】appointment 约会，约定,17
representative,担当者、代表,名,ˌrɛprɪˈzɛntətɪv,The company sent a representative to discuss the proposal.,公司派了一名代表来讨论方案。,【其他—形】代表的；【动】represent 代表,17
payroll,工资名单，工资总支出,名,ˈpeɪrəʊl,The company handles payroll processing every month.,公司每月都会处理工资单。,,17
profit,利益，收益,名,ˈprɒfɪt,The company saw a significant increase in profit.,公司利润大幅增长。,,17
raise,增加，提高,动,reɪz,The company decided to raise employee salaries to attract and retain top talent.,公司决定提高员工工资，以吸引和留住优秀人才。,,17
consolidate,合并,动,kənˈsɒlɪdeɪt,The company decided to consolidate its various departments for improved efficiency.,公司决定合并各个部门，以提高效率。,【名】consolidation 巩固，合并,17
luncheon,午宴,名,ˈlʌnʧən,The company hosted a luncheon to celebrate successful product release.,公司举行午宴庆祝产品成功发布。,,17
overseas,在国外,副,ˌəʊvəˈsiːz,The company expanded its business overseas to reach new markets.,公司将业务拓展到海外，以进入新的市场。,【其他—形】,17
reimburse,报销，偿还,动,ˌriːɪmˈbɜːs,The company will reimburse your travel expenses.,公司将报销您的差旅费。,【名】reimbursement 报销,17
recruit,招聘，雇佣,动,rɪˈkruːt,The company plans to recruit skilled professionals to expand its workforce.,公司计划招聘有技能的专业人员来扩大员工队伍。,【名】recruitment 招聘，recruiter 招聘者 ,17
extend,延长,动,ɪkˈstɛnd,The company plans to extend its services to Europe.,公司计划将服务扩展到欧洲。,,17
release,发布，上新，释放,动,rɪˈliːs,The company plans to release the latest software update to improve functionality.,公司计划发布最新的软件更新，以改进功能。,【近】launch 上新，推出,17
usage,使用量，使用,名,ˈjuːsɪʤ,The frequent usage of the company's conference room prompted the need for a reservation system.,公司会议室使用频繁，因此需要一个预订系统。,,17
promote,提拔，晋升，推销，推动,动,prəˈməʊt,Companies promote products for visibility.,公司会推广产品以提高知名度。,【动】promote；【名】promotion,17
ship,发送，运送,动,ʃɪp,The company will ship the package to your address.,公司会将包裹寄到您的地址。,,17
quarterly,季度地,名,ˈkwɔːtəli,The company publishes quarterly reports to update stakeholders.,公司发布季度报告，为利益相关者提供最新信息。,【固】quarterly report 季度报告,17
policy,政策，规定,名,ˈpɒləsi,The company has a strict policy on punctuality.,公司对守时性有严格的规定。,,17
guideline,指南，准则,名,ˈɡaɪdlaɪn,The company's guideline ensures ethical business practices.,公司的指导方针确保了商业行为的道德性。,,17
existing,现存的,形,ɪɡˈzɪstɪŋ,The company's existing policies are under review.,公司的现行政策正在审查中。,【动】exist 存在,17
chief,首席的，主要的,形,ʧiːf,The chief concern of the company is to improve customer satisfaction.,公司的首要考量是提高客户满意度。,,17
operation,营业，操作，实施，手术,名,ˌɒpᵊrˈeɪʃᵊn,The company's daily operation involves manufacturing and shipping products.,公司的日常运营包括生产和运输产品。,【动】operate 操作,17
gain,获得，取得,动,ɡeɪn,The company aims to gain a larger market share.,公司的目标是获得更大的市场份额。,【其他—名】收获；收益,17
turnover,营业额，离职率,名,ˈtɜːnˌəʊvə,The high turnover rate in the company indicated issues with employee retention.,公司的高离职率表明在留住员工方面存在问题。,【固】annual turnover  年度营业额,17
race,竞争,动,reɪs,The company's products range across various fields.,公司的产品涉及各个领域。,【其他—名】竞赛,17
petition,请愿,名,pəˈtɪʃᵊn,Citizens can submit a petition to express their concerns to the government.,公民可以提交请愿书，向政府表达他们的担忧。,,17
normally,普通地，通常地,副,ˈnɔːmᵊli,The bus normally arrives at the stop by 8 AM.,公交车通常在早上 8 点前到站。,,17
