Word,Meaning,POS,Phonetic,Example,Translation,Note,Unit
present,提出，提交，馈赠，发表,动,prɪˈzɛnt ,He'll present the research findings in the meeting.,他将在会上介绍研究成果。,【其他—形】出席的；在场的 /ˈprɛznt/,10
propose,提出,动,prəˈpəʊz,He'll propose a new efficiency strategy.,他将提出新的效率战略。,【名】proposal 提议,10
token,记号，表示，代金券,名,ˈtəʊkᵊn,He gave her a small token of appreciation for her help.,他给了她一点小礼物，以感谢她的帮助。,,10
automobile,汽车,名,ˈɔtəməʊˌbil,He just bought a new automobile with advanced safety features.,他刚买了一辆具有先进安全功能的新车。,,10
acknowledge,承认，感谢,动,əkˈnɒlɪʤ,He acknowledged the hard work of his team in the project.,他对项目团队的辛勤工作表示肯定。,【名】acknowledgement,10
contribution,贡献,名,ˌkɒntrɪˈbjuːʃᵊn,His contribution to the project was invaluable.,他对项目的贡献不可估量。,,10
regret,后悔,动,rɪˈɡrɛt,He expressed regret for not attending the important meeting.,他对未能出席这次重要会议表示遗憾。,【形】regretful 遗憾的,10
analysis,分析,名,əˈnæləsɪs,His analysis of the data revealed some surprising trends.,他对数据的分析揭示了一些令人惊讶的趋势。,【动】analyse/analyze；【注】复数 analyses,10
delivery,配送,名,dɪˈlɪvᵊri,The prompt delivery of the package was appreciated.,他对包裹的及时交付表示赞赏。,【动】deliver,10
presentation,提交，发表，展示，发布会,名,ˌprɛzᵊnˈteɪʃᵊn,His presentation impressed the entire audience.,他的演讲给全场观众留下了深刻印象。,,10
proposal,提案,名,prəˈpəʊzᵊl,His proposal for a new business was well-received by investors.,他的新业务提案受到了投资者的欢迎。,,10
costume,戏服,名,ˈkɒstjuːm,His costume for the play was elaborate.,他的戏服很精致。,【易混】custom 传统，习俗,10
response,回复,名,rɪsˈpɒns,He received a positive response to his proposal.,他的提议得到了积极响应。,【动】respond 回应，回复,10
dedication,献身，奉献,名,ˌdɛdɪˈkeɪʃᵊn,His dedication to his work is admired by his colleagues.,他的敬业精神令同事们钦佩不已。,【动】dedicate,10
nomination,推荐，提名,名,ˌnɒmɪˈneɪʃᵊn,His nomination for the award was well-deserved.,他的获奖提名实至名归。,【动】nominate 提名,10
arrival,到达,名,əˈraɪvᵊl,His arrival at the party was quite unexpected.,他的到来出人意料。,【动】arrive,10
guarantee,保证,动,ˌɡærᵊnˈtiː,His presence guarantees that the event will be a success,他的出现保证了活动的成功,【其他—名】,10
imply,意味着,动,ɪmˈplaɪ,His silence seemed to imply agreement with the proposed plan.,他的沉默似乎意味着同意提议的计划。,,10
accurate,精确的,形,ˈækjʊrət,His report was accurate and detailed.,他的报告准确而详细。,【名】accuracy 精确,10
grocery,食品杂货,名,ˈɡrəʊsᵊri,He picked up fresh vegetables from the grocery store.,他从杂货店购买了新鲜蔬菜。,,10
portion,部分，食物的一份,名,ˈpɔːʃᵊn,He ate a small portion of the delicious cake.,他吃了一小块美味的蛋糕。,,10
aside,在一边，一旁,副,əˈsaɪd,He set the book aside and took a break.,他把书放在一边，休息了一会儿。,,10
associate,同事，伙伴,名,əˈsəʊʃiət,He trusted his business associate with the running of the law firm.,他把律师事务所的经营权交给了自己的生意伙伴。,【其他—动】联系；【音】/əˈsəʊsɪeɪt/,10
mandatory,强制的,名,ˈmændətᵊri,Attendance at the safety training session is mandatory for all employees.,所有员工都必须参加安全培训课程。,,10
domestic,国内的,形,dəʊˈmɛstɪk,The domestic economy thrived as more people started investing in local businesses.,随着越来越多的人开始投资当地企业，国内经济蓬勃发展。,,10
imagine,想象,动,ɪˈmæʤɪn,It's fascinating to imagine what the future might hold with advancements in technology.,随着技术的进步，想象一下未来会发生什么，是一件令人着迷的事情。,【名】imagination ,10
though,然而，尽管,连,ðəʊ,They completed the project on time though it was challenging.,虽然项目具有挑战性，但他们还是按时完成了任务。,,10
hesitant,犹豫,形,ˈhɛzɪtᵊnt,Although hesitant at first she eventually agreed to take on the leadership role.,虽然起初有些犹豫，但她最终还是同意担任领导角色。,,10
specifically,具体地,副,spəˈsɪfɪkᵊli,The instructions were written specifically for beginners.,说明书是专门为初学者编写的。,【形/名】specific 具体的/具体的东西,10
element,要素，元素,名,ˈɛlɪmənt,Water is a vital element for all living organisms.,水是所有生物的重要元素。,,10
spa,温泉设施，休闲健身中心,名,spɑː,A spa day is relaxing.,水疗日让人身心放松。,,10
plumber,水暖工，管道工,名,ˈplʌmə,The plumber fixed the leaking sink in the kitchen.,水管工修好了厨房漏水的水槽。,,10
digital,数码的,形,ˈdɪʤɪtᵊl,Digital technology has transformed the way we communicate.,数字技术改变了我们的沟通方式。,,10
stack,一摞，堆叠,名,stæk,Books are neatly stacked on the shelf.,书籍整齐地堆放在书架上。,【其他—动】堆叠；摞起,10
series,系列,名,ˈsɪəriːz,The bookstore offers a popular series of novels.,书店提供了一系列广受欢迎的小说。,【注】单复数同形,10
resign,辞职,动,rɪˈzaɪn,The CEO chose to resign from his position due to personal reasons.,首席执行官因个人原因选择辞职。,,10
stress,强调,动,strɛs,The CEO stresses constantly the importance of teamwork.,首席执行官不断强调团队合作的重要性。,【其他—名】,10
manual,说明书，使用手册,名,ˈmænjuəl,The manual provides proper assembly instructions.,手册中提供了正确的组装说明。,【形】手动的,10
cashier,收银员，出纳,名,kæˈʃɪə,The cashier efficiently processed the transactions at the checkout counter.,收银员在结账柜台高效地处理了交易。,,11
total,合计,名,ˈtəʊtᵊl,The cashier calculated the total of the items before processing the payment.,收银员在处理付款之前计算了物品的总额。,【其他—形】总计的,11
waste,垃圾，浪费,名,weɪst,Proper recycling helps minimize waste.,适当的回收有助于最大限度地减少浪费。,【其他—动】浪费,11
set,设置，放，安排,动,sɛt,It's time to set the table for dinner.,是时候准备晚餐了。,【其他—名】一套,11
upgrade,升级,动,ʌpˈɡreɪd,It's time to upgrade your phone for better features.,是时候升级您的手机以获得更好的功能了。,【其他—名】,11
beforehand,提前，事先,副,bɪˈfɔːhænd,Planning beforehand allows for a smoother execution of complex projects.,事先规划可以让复杂项目的执行更加顺利。,,11
entertaining,有趣的，娱乐的,形,ˌɛntəˈteɪnɪŋ,The movie proved to be highly entertaining.,事实证明，这部电影极具娱乐性。,【动】entertain 款待，娱乐；【名】entertainment,11
method,方法,名,ˈmɛθəd,The new teaching method proved to be more effective in engaging students.,事实证明，新的教学方法能更有效地吸引学生。,,11
newly,最近地,副,ˈnjuːli,A tall building was newly constructed in the city center.,市中心新建了一座高楼。,,11
crowd,人群,名,ˈkraʊdɪd,The city center is often crowded especially during rush hours.,市中心经常很拥挤，尤其是在上下班高峰期。,,11
bistro,小餐馆，小酒馆,名,ˈbiːstrəʊ,The bistro downtown serves excellent French cuisine.,市中心的小酒馆供应一流的法国菜。,,11
estate,地产，财产,名,ɪˈsteɪt,Real estate in the city center is highly valued.,市中心的房地产价值很高。,,11
sculpture,雕塑,名,ˈskʌlpʧə,The city erected a new sculpture in the park.,市政府在公园里竖起了一座新雕塑。,,11
municipal,市政的，地方政府的，市营的,形,mjuːˈnɪsɪpᵊl,The municipal government is responsible for local services.,市政府负责当地的各项服务。,,11
mayor,市长,名,meɪə,The mayor addressed the citizens during the town hall meeting.,市长在市政厅会议上向市民发表了讲话。,,11
repave,重新铺设,动,ˌriːˈpeɪv,The city council decided to repave the main road to improve driving conditions.,市议会决定重新铺设主干道，以改善行车条件。,【名】pavement 人行道，路面,11
permit,许可,名,ˈpɜːmɪt,The city council issued a permit for the construction of a new building.,市议会颁发了建造新楼的许可证。,【其他—动】允许 /pəˈmɪt/,11
elect,选择,动,ɪˈlɛkt,The citizens will elect their new representative in the upcoming elections.,市民们将在即将举行的选举中选出他们的新代表。,【名】 election 选举,11
exchange,交换，兑换,动,ɪksˈʧeɪnʤ,Everyone in the marketing department exchanged their ideas at the conference.,市场营销部的每个人都在会上交流了自己的想法。,【其他—名】,11
produce,农作物,名,ˈprɒdjuːs,The market offers a variety of fresh produce,市场提供各种新鲜产品,【其他—动】【音】 生产 /prəˈdjuːs/,11
department,部门；系,名,dɪˈpɑːtmənt,The marketing department handles promotional activities.,市场部负责促销活动。,【形】departmental 部门的；【近】division 部门,11
ladder,梯子,名,ˈlædə,Using a ladder can make it easier to reach high shelves.,使用梯子可以更方便地够到高处的货架。,,11
coupon,优惠券,名,ˈkuːpɒn,Use this coupon to avail of a discount on your next purchase.,使用此优惠券可在下次购车时享受折扣。,,11
sample,采样，品尝，尝试,名,ˈsɑːmpᵊl,The laboratory received a sample for analysis and testing.,实验室收到一份样本，用于分析和测试。,,11
intern,实习生，实习医师,名,ˈɪntɜːn,The intern gained valuable experience working with the marketing team.,实习生获得了与营销团队合作的宝贵经验。,【名】internship 实习,11
actual,实际的,形,ˈækʧuəl,The actual cost was higher than the estimate.,实际成本高于估算。,【副】actually,11
trend,趋势,名,trɛnd,Trend in fashion is shifting towards bold colors.,时尚潮流正转向一些大胆的色彩。,,11
alert,使…警觉,动,əˈlɜːt,Stay alert for any changes in the schedule.,时刻关注日程安排的任何变化。,【其他—名】提醒，警告；【其他—形】警惕的,11
constraint,约束,名,kənˈstreɪnt,Time constraints may affect the completion of the project.,时间限制可能会影响项目的完成。,【动】constrain 限制，约束,11
asset,资产,名,ˈæsɛt,Time management is a valuable asset in achieving personal and professional goals.,时间管理是实现个人和职业目标的宝贵财富。,,11
factor,要素,名,ˈfæktə,Time management is a crucial factor for success.,时间管理是成功的关键因素。,,11
means,手段，方法,名,miːnz,Saving money is one means of achieving financial goals.,省钱是实现财务目标的一种手段。,【注】本身即单数或复数名,11
wildlife,野生动物,名,ˈwaɪldlaɪf,Conservation efforts protect wildlife habitats.,生态上的努力能够保护野生动物栖息地。,,11
salary,薪资,名,ˈsæləri,Her salary increased after the promotion.,升职后，她的工资增加了。,,11
interview,面试,动,ˈɪntəvjuː,The applicants were interviewed for admission.,申请者接受了入学面试。,【名】interviewer 面试者；【名】interviewee 受试者,11
thriving,繁荣的,形,ˈθraɪvɪŋ,The community garden is thriving with plants and flowers in full bloom.,社区花园欣欣向荣，花草竞相开放。,,11
community,社区，社团,名,kəˈmjuːnəti,The community came together to organize a neighborhood cleanup.,社区共同组织了一次邻里大扫除。,,11
grateful,感激的,形,ˈɡreɪtfᵊl,The community was grateful for the volunteers who helped rebuild after the natural disaster.,社区对帮助灾后重建的志愿者表示感谢。,【名】gratitude 感激之情,11
initiative,倡议,名,ɪˈnɪʃətɪv,The community initiative focuses on environmental conservation.,社区倡议聚焦于环境保护。,,11
influence,影响,动,ˈɪnfluəns,Social media can greatly influence consumer behavior.,社交媒体可以极大地影响消费者的行为。,【其他—名】,11
social,社会的,形,ˈsəʊʃᵊl,Social interactions are crucial for building meaningful connections with others.,社交互动对于与他人建立有意义的联系至关重要。,【名】socety 社会,11
reform,改革,动,ˌriːˈfɔːm,Social reform is essential for addressing issues of inequality in society.,社会改革对于解决社会不平等问题至关重要。,,11
preceding,在前的，前述的,形,prɪˈsiːdɪŋ,The preceding chapter laid the foundation for the concepts discussed in this section.,上一章为本节讨论的概念奠定了基础。,【动】preceed 先于,11
fluctuate,波动,动,ˈflʌkʧueɪt,Prices of commodities may fluctuate based on market demand and supply.,商品价格可能会根据市场供求关系而波动。,【名】fluctuation,11
conveniently,方便地,副,kənˈviːniəntli,The store is conveniently located near the subway station.,商店位于地铁站附近，交通便利。,【名】convenience 便利；【反】inconvenient 不便的,11
typically,典型地，通常地,副,ˈtɪpɪkᵊli,The store typically opens at 9 AM every day.,商店通常每天上午 9 点开门。,【形】typical 典型的,11
purchase,购买,动,ˈpɜːʧəs,The store offers discounts to encourage purchases.,商店提供折扣以鼓励消费。,【其他—名】,11
variety,多样性,名,vəˈraɪəti,The store offers a variety of products to suit different needs.,商店提供各种产品以满足不同需求。,,11
range,变动，（范围）包括,动,reɪnʤ,The store offers a wide range of products.,商店提供的产品种类繁多。,【其他—名】范围,11
merchandise,商品,名,ˈmɜːʧəndaɪz,The store sells a variety of merchandise.,商店出售各种商品。,,11
surface,浮现,动,ˈsɜːfɪs,The shiny surface of the lake reflected the clear blue sky.,闪亮的湖面倒映着湛蓝的天空。,【其他—名】表面,11
abundant,丰富,形,əˈbʌndᵊnt,The forest is abundant with diverse plant and animal species.,森林里有丰富多样的动植物物种。,【名】 abundance 丰裕,11
outdated,过时,形,aʊtˈdeɪtɪd,The software became outdated and there was an need for an upgrade.,软件已经过时，需要升级。,,11
version,版本,名,ˈvɜːʒᵊn,The software engineer released an upgraded version of the application.,软件工程师发布了应用程序的升级版本。,,11
orientation,迎新会， 目标， 方向,名,ˌɔːriənˈteɪʃᵊn,The orientation introduced new employees to the company's rules.,入职培训向新员工介绍了公司的规章制度。,,11
refer,参考,动,rɪˈfɜː,Refer to the user manual for instructions when you are in doubt.,如有疑问，请参阅用户手册获取说明。,【名】reference 参考，引用/ referral 推荐，介绍,11
hesitate,犹豫,动,ˈhɛzɪteɪt,Don't hesitate to ask for help if you need it.,如果需要帮助，请不要犹豫。,,11
measure,措施；衡量,名,ˈmɛʒə,Goals for this quarter couldn't have been achieved without the implemention of the new measure.,如果没有新措施的实施，本季度的目标就不可能实现。,【其他—动】测量,11
precision,精确,名,prɪˈsɪʒᵊn,The success of the mission depended on the precision of the instruments.,任务的成功取决于仪器的精确度。,,11
commitment,承诺,名,kəˈmɪtmənt,Success in any endeavor requires a strong commitment to the goals and objectives.,任何工作的成功都需要对目标和目的的坚定承诺。,【易混】commission 佣金，提成,11
dialogue,对话,名,ˈdaɪəlɒɡ,The characters engaged in a meaningful dialogue to resolve their differences.,人物之间进行了有意义的对话，以解决他们之间的分歧。,,11
personnel,全体人员，人事部门,名,ˌpɜːsᵊnˈɛl,The personnel department manages employee records and benefits.,人事部负责管理员工档案和福利。,,11
destination,目的地,名,ˌdɛstɪˈneɪʃᵊn,The tropical island is a popular tourist destination.,热带岛屿是热门的旅游目的地。,,11
shorten,缩短,动,ˈʃɔːtᵊn,Let's shorten the meeting agenda to save time.,让我们缩短会议议程，节省时间。,,11
brief,简短，简洁的,形,briːf,Keep your explanation brief and to the point.,让你的解释要简明扼要，切中要害。,,12
refrigerator,冰箱,名,rɪˈfrɪʤᵊreɪtə,Make sure to keep perishable items in the refrigerator to maintain freshness.,确保将易腐物品放在冰箱里以保持新鲜。,,12
wheel,车轮,名,wiːl,The bicycle with a missing wheel was temporarily out of commission.,缺少车轮的自行车暂时无法使用。,,12
faculty,全体教员，本科院系,名,ˈfækəlti,The faculty members contribute to the university's academic environment.,全体教师们为大学的学术环境做出了贡献。,,12
occasion,机会， 场合,名,əˈkeɪʒᵊn,The family gathered for a special occasion.,全家人欢聚一堂，庆祝特殊的时刻。,,12
successive,连续的，始终如一的,形,səkˈsɛsɪv,The team celebrated their third successive victory in the championship.,球队庆祝了他们在锦标赛中的第三次连胜。,【固】in successive order  连续的顺序,12
disappointed,失望的,形,ˌdɪsəˈpɔɪntɪd,The team was disappointed with the outcome of the championship game.,球队对冠军赛的结果感到失望。,,12
confirm,确认,动,kənˈfɜːm,Please confirm your attendance at the event by Friday.,请在周五之前确认您是否出席此次活动。,【名】confirmation,12
written,书面的,形,ˈrɪtᵊn,Please submit the written form by Tuesday.,请在周二之前提交书面表格。,,12
document,文书，书类,名,ˈdɒkjəmənt,Please sign this document before leaving.,请在离开前签署本文件。,【动】记录,12
thoroughly,彻底地,副,ˈθʌrəli,Please clean the area thoroughly before leaving.,请在离开前彻底清洁该区域。,【形】thorough 彻底的,12
sign,签名,动,saɪn,Please sign your name on the attendance sheet.,请在考勤表上签上您的名字。,【名】signiture 签名,12
submit,提交,动,səbˈmɪt,Please submit your completed application by the deadline.,请在截止日期前提交完整的申请。,【名】submission 提交,12
reserve,预约，确保,动,rɪˈzɜːv,Please reserve a table for two at the restaurant for this evening.,请在餐厅预订今晚的双人桌。,【名】reservation 保留,12
remind,提醒,动,rɪˈmaɪnd,Let me remind you of the important deadline for submitting your report.,请允许我提醒您提交报告的重要截止日期。,,12
excuse,原谅，宽恕,动,ɪkˈskjuːz,Please excuse my tardiness; I was caught in traffic.,请原谅我的迟到；我遇到了交通堵塞。,【其他—名】借口,12
note,注，指出，留意,动,nəʊt,Emplyees are asked to note important information to review later.,请员工记下重要信息，以便日后查看。,【其他—名】笔记,12
profile,轮廓，简介，概述,名,ˈprəʊfaɪl,Please update your online profile with recent information.,请用最新信息更新您的在线资料。,,12
belongings,随身物品，所有物,名,bɪˈlɒŋɪŋz,Please make sure to take all your belongings before departure.,请务必在出发前带好您的随身物品。,【注】本身即复数形式；【动】belong 属于,12
receipt,收据,名,rɪˈsiːt,Make sure to keep the receipt for your purchase in case you need to return the item.,请务必保留购物收据，以备退货之需。,,12
doorway,门口，出入口,名,ˈdɔːweɪ,Stand clear of the doorway to let others enter.,请勿站在门口妨碍他人进入。,,12
leave,离开，遗留,动,liːv,Please leave your contact information for follow-up.,请留下您的联系方式，以便我们跟进。,【其他—名】休假,12
notify,通知,动,ˈnəʊtɪfaɪ,Pleas notify the authorities immediately for assistance.,请立即通知有关部门寻求帮助。,【名】notification 通知,12
inform,通知,动,ɪnˈfɔːm,Please inform the manager about the changes.,请将这些变化告知经理。,,12
file,文件归档；提起诉讼,动,faɪl,Please file the documents in the top drawer.,请将文件归档到最上面的抽屉。,【其他—名】文件，文档,12
cart,手推车,名,kɑːt,Please place the items in the shopping cart for checkout.,请将商品放入购物车结账。,,12
plastic,塑料,名,ˈplæstɪk,Please recycle plastic to help the environment.,请回收塑料，保护环境。,,12
reply,回复,动,rɪˈplaɪ,Please reply to the email to confirm your attendance at the meeting.,请回复邮件确认出席会议。,,12
railing,扶手,名,ˈreɪlɪŋ,Please hold onto the railing for support on the stairs.,请扶着栏杆上楼梯。,,12
invoice,发票，发货单，请求书，明细书,名,ˈɪnvɔɪs,Please review the invoice and submit payment by the due date.,请查看发票，并在截止日期前付款。,,12
format,形式，格式,名,ˈfɔːmæt,Please follow the correct format for the report.,请按照正确的格式撰写报告。,,12
medication,药物,名,ˌmɛdɪˈkeɪʃᵊn,Take your medication as prescribed by the doctor.,请按医嘱服药。,,12
lightweight,轻量的,形,ˈlaɪtweɪt,A lightweight backpack is essential for the trip.,轻便的背包是旅行的必备品。,,12
overlook,忽略；眺望,动,ˌəʊvəˈlʊk,Always remember not to overlook details.,切记不要忽略细节。,,12
leadership,领导能力,名,ˈliːdəʃɪp,Strong leadership is beneficial for cohesiveness.,强有力的领导有利于增强凝聚力。,,12
former,先前的,形,ˈfɔːmə,The former CEO remains a consultant for the company.,前任首席执行官仍然是公司的顾问。,【反】latter 后者的,12
obligate,使负有法律义务,动,ˈɒblɪɡeɪt,Signing the contract will obligate you to fulfill the terms and conditions.,签署合同意味着您有义务履行合同的条款和条件。,【固】obligate someone to do something  迫使某人做某事 feel obligated to 感到有责任、义务,12
industry,产业，业界,名,ˈɪndəstri,The automobile industry is rapidly embracing electric vehicles.,汽车行业正在迅速迎接并接受电动汽车。,【形】industrial 工业的,12
predict,预测,动,prɪˈdɪkt,Meteorologists use advanced technology to predict weather patterns accurately.,气象学家利用先进技术准确预测天气模式。,,12
worldwide,全世界,形,ˌwɜːldˈwaɪd,The impact of climate change is a worldwide concern that requires global cooperation.,气候变化的影响是全球关注的问题，需要全球合作。,,12
rely,依靠,动,rɪˈlaɪ,Businesses often rely on customer satisfaction to improve products and services.,企业通常依靠客户满意度来改进产品和服务。,,12
down,沮丧的，失落的,形,daʊn,She felt a bit down after the results of the final exam came out.,期末考试成绩出来后，她的心情有些低落。,,12
praise,表扬,动,preɪz,The judges praised the performers for their outstanding performance.,评委们对表演者的出色表现大加赞赏。,,12
critic,评论家，批评者,名,ˈkrɪtɪk,The critic praised the novel for its originality and depth.,评论家称赞这部小说具有独创性和深度。,,12
evaluation,评价,名,ɪˌvæljuˈeɪʃᵊn,The evaluation process was thorough and fair.,评估过程全面且公正。,【动】evaluate,12
graphic,图形的,形,ˈɡræfɪk,Graphic design plays a key role in advertising.,平面设计在广告中起着关键作用。,,12
rafting,漂流运动，激流划舟,名,ˈrɑːftɪŋ,Rafting is an exciting water sport.,漂流是一项刺激的水上运动。,,12
critical,批评的，关键的,形,ˈkrɪtɪkᵊl,Critical thinking skills are essential in this job.,批判性思维能力在这份工作中至关重要。,,12
chat,聊天，闲聊,名,ʧæt,Friends often chat casually during lunch breaks.,朋友们经常在午休时间闲聊。,,12
intensive,集中的，密集的，彻底的,形,ɪnˈtɛnsɪv,Training requires intensive effort.,培训需要投入大量精力。,,12
session,集会，会议,名,ˈsɛʃᵊn,The training session lasted for two hours.,培训课程持续了两个小时。,,12
theme,主题,名,θiːm,The party had a Hawaiian theme with tropical decorations.,派对以夏威夷为主题，配以热带风情的装饰。,,12
mop,拖（地）,动,mɒp,Someone had to mop the floor to clean up the spills after the party.,派对结束后，必须有人拖地来清理溅出的水渍。,【注】sweep 扫地 过去式/过去分词 swept,12
housekeeper,管家,名,ˈhaʊsˌkiːpə,The housekeeper diligently cleaned and organized the rooms in the hotel.,女管家勤勤恳恳地打扫和整理酒店客房。,【形】 housekeeping 家政的,12
reward,报酬,名,rɪˈwɔːd,Hard work often leads to a sense of accomplishment and reward.,努力工作往往会带来成就感和回报。,【动】酬谢,12
