Word,Meaning,POS,Phonetic,Example,Translation,Note,Unit
shortly,短暂地，马上,副,ˈʃɔːtli,Get prepared. The meeting will start shortly.,做好准备。会议马上就要开始了。,,1
author,作者,名,ˈɔːθə,The author signed copies of her latest book at the event.,作者在活动现场为她的新书签名。,,1
manuscript,原稿,名,ˈmænjəskrɪpt,The author submitted the manuscript to the publisher.,作者向出版社提交了手稿。,,1
occur,发生,动,əˈkɜː,Several car accidents occurred on the 5th avenue yesterday.,昨天，第五大道上发生了几起车祸。,,1
observe,观察，监视遵守,动,əbˈzɜːv,Observing rules ensures a safe construction site.,遵守规则能确保施工现场安全。,【名】observance 遵守；【名】observation 观察,1
minimum,最小量，最小化,名,ˈmɪnɪməm,Following the safety guidelines meets only minimum requirements.,遵守安全指南只是最低的要求。,【反】maximum 最大量,1
edition,版本,名,ɪˈdɪʃᵊn,The latest edition of the magazine features a celebrity interview.,最新一期杂志刊登了一篇名人访谈。,,1
acquisition,收购，购买；习得,名,ˌækwɪˈzɪʃᵊn,The latest acquisitions have to be catalogued first.,最近添置的物品得先编目。,【动】acquire,1
recent,最近的,形,ˈriːsᵊnt,The recent advancements in technology have revolutionized many industries.,最近的技术进步给许多行业带来了革命性的变化。,,1
exit,出口,名,ˈɛksɪt,The nearest exit is at the end of the hallway.,最近的出口在走廊尽头。,【其他—动】,1
optimal,最佳的,形,ˈɒptɪmᵊl,The optimal solution was to streamline the process for greater efficiency.,最佳解决方案是简化流程，提高效率。,,1
initial,最初的，开始的,形,ɪˈnɪʃᵊl,The initial stage is for planning.,最初阶段要做计划。,【动】initiate 发起；【名】initiative 提案；【副】initially,1
tenant,租客,名,ˈtɛnənt,The tenant moved into the apartment last month.,租户上个月搬进了公寓。,,1
deposit,存款，押金，订金,名,dɪˈpɒzɪt,A deposit is required to secure the rental property.,租房需要押金。,【其他—动】存放,1
hallway,门厅，走廊，过道,名,ˈhɔːlweɪ,The hallway was decorated with pictures from their travels.,走廊上挂满了他们的旅行照片。,,1
officially,正式地，官方地,副,əˈfɪʃᵊli,The president officially declared a national holiday.,总统正式宣布全国放假。,,1
preparation,准备,名,ˌprɛpəˈreɪʃᵊn,Good preparation is crucial for success in any endeavor.,准备充分是任何工作取得成功的关键。,【动】prepare 准备,1
certification,认证,名,ˌsɜːtɪfɪˈkeɪʃᵊn,Professional certification enhances credibility in the job market.,专业认证提高了在就业市场上的可信度。,【形】 certified 受认证的 ,1
association,协会,名,əˌsəʊsiˈeɪʃᵊn,The association of professionals provides a platform for networking and collaboration.,专业人士协会提供了一个交流与合作的平台。,【固】in association with 与...合作  have an association with  与...有关系,1
specialist,专家,名,ˈspɛʃəlɪst,The specialist offered valuable advice.,专家提供了宝贵的建议。,,1
differ,有别于,动,ˈdɪfə,The opinions of the experts differ on this matter.,专家们对此意见不一。,【固】differ from … 与…不同,1
nutrition,营养,名,njuːˈtrɪʃᵊn,Pay attention to nutrition for a healthy lifestyle.,注营养，养成健康的生活方式。,【形】nutritious 有营养的,1
duplicate,复制,动,ˈdjuːplɪkeɪt,Be cautious to avoid creating a duplicate file with the same name.,注意避免创建同名重复文件。,【名】 duplication 复制，重复,1
address,演说，讲述,动,əˈdrɛs,The president will now address the meeting.,主席现在向会议致辞。,【其他—名】【音】地址 AmE / ˈæˌdrɛs/,1
supervisor,监督者，上级,名,ˈsuːpəvaɪzə,The supervisor oversees the team's daily tasks.,主管负责监督团队的日常工作。,【动】supervise 监督,1
complain,抱怨,动,kəmˈpleɪn,It's essential to address concerns rather than constantly complain about them.,重要的是要解决关注的问题，而不是不断地抱怨。,,1
mention,提及,动,ˈmɛnʃᵊn,Key points should be mentioned to highlight our achievements.,重点是要强调我们的成就。,【其他—名】,1
pharmaceutical,制药的,形,ˌfɑːməˈsuːtɪkᵊl,The pharmaceutical company developed a new medication to treat a rare disease.,制药公司开发了一种治疗罕见疾病的新药。,,1
strategy,战略,名,ˈstrætɪʤi,Developing a solid marketing strategy is crucial for the success of any business.,制定稳健的营销战略对任何企业的成功都至关重要。,,1
contribute,贡献,动,kənˈtrɪbjuːt,Volunteers contribute significantly to the success of the festival.,志愿者为节日活动的成功做出了巨大贡献。,【固】contribute to … 对…做贡献；【名】contribution,1
eligible,有资格的,形,ˈɛlɪʤəbᵊl,Only members are eligible for the special discounts.,只有会员才能享受特别折扣。,【固】be eligible for … 有…的资格,1
whenever,无论何时,连,wɛˈnɛvə,Feel free to call whenever you have time.,只要您有时间，随时欢迎来电。,,1
executive,行政部门，行政官，主管,名,ɪɡˈzɛkjətɪv,The executive team met to discuss the company's future.,执行团队开会讨论公司的未来。,,1
deficit,赤字,名,ˈdɛfɪsɪt,The government worked to reduce the budget deficit through fiscal responsibility.,政府努力通过财政责任来减少预算赤字。,【形】deficient不足的,1
sort,分类,动,sɔːt,It can take some time to sort one's belongings.,整理物品需要一些时间。,,1
workplace,职场，工作地,名,ˈwɜːkˌpleɪs,A clean and organized workplace boosts productivity.,整洁有序的工作场所可提高工作效率。,,1
entire,全部的,形,ɪnˈtaɪə,The entire book was captivating from start to finish.,整本书从头到尾都很吸引人。,【名】entirety 整体；全部,1
clinic,诊所,名,ˈklɪnɪk,The clinic offers a range of medical services for patients.,诊所为患者提供一系列医疗服务。,,1
closely,紧紧地，仔细地,副,ˈkləʊsli,The detectives closely examined the evidence at the scene.,侦探们仔细检查了现场的证据。,,1
reveal,揭示,动,rɪˈviːl,The detective's investigation helped reveal the truth behind the mysterious disappearance.,侦探的调查帮助揭开了神秘失踪案的真相。,【名】revelation ,1
connect,连接,动,kəˈnɛkt,The new bridge will connect the two cities across the river.,这座新桥将连接河对岸的两座城市。,【名】connection,1
getaway,短期休假，逃亡,名,ˈɡɛtəweɪ,The island is a perfect getaway for a relaxing vacation.,这座小岛是休闲度假的绝佳去处。,,1
solid,固体的，坚实的,形,ˈsɒlɪd,The bridge was built with solid materials to withstand harsh weather conditions.,这座桥用坚固的材料建造，可以抵御恶劣的天气条件。,,1
restoration,修复,名,ˌrɛstəˈreɪʃᵊn,The restoration of the historic building took years.,这座历史建筑的修复工作耗时多年。,【动】restore 恢复,1
historic,历史上的,形,hɪˈstɒrɪk,The historic building was preserved as a cultural heritage site.,这座历史建筑被作为文化遗产保存了下来。,,1
architectural,建筑的,形,ˌɑːkɪˈtɛkʧᵊrᵊl,The building is known for its unique architectural design.,这座建筑以其独特的建筑设计而闻名。,,1
diverse,多样的,形,daɪˈvɜːs,The city is known for its diverse cultural heritage.,这座城市以其多样化的文化遗产而闻名。,【名】diversity 多样性；【动】diversify （使）多样化,1
development,发展,名,dɪˈvɛləpmənt,The city has seen rapid development in recent years.,这座城市近年来发展迅速。,,1
tourism,观光旅行，观光业,名,ˈtʊərɪzᵊm,The city relies on tourism for economic growth.,这座城市的经济增长主要依靠旅游业。,,1
contain,包含,动,kənˈteɪn,This beverage does not contain any artificial sweeteners.,这种饮料不含任何人工甜味剂。,【名】container 容器,1
boost,提高，激励,动,buːst,The news helped boost the company's stock prices.,这则消息帮助提高了公司的股票价格。,【其他—名】,1
dramatically,戏剧地，显著地,副,drəˈmætɪkᵊli,The company's growth has increased dramatically over the years.,这些年来，公司的增长速度显著加快。,【近】drastically 急剧地，幅度大地,1
worth,值钱的，值…钱,形,wɜːθ,The antique furniture is worth a considerable amount.,这些古董家具价值不菲。,,1
patron,常客，赞助商，顾客,名,ˈpeɪtrən,The loyal patron visits the restaurant every week.,这位忠实的顾客每周都会光顾这家餐厅。,,1
renowned,有名的，知名的,形,rɪˈnaʊnd,The renowned artist received acclaim for her exceptional paintings.,这位知名艺术家因其卓越的画作而广受赞誉。,,1
pottery,陶器,名,ˈpɒtᵊri,The artist molded beautiful pottery from clay.,这位艺术家用粘土塑造了精美的陶器。,,1
fashion,方式,名,ˈfæʃᵊn,"""The artist created her masterpiece in a unique fashion.",这位艺术家以独特的方式创作了她的杰作,【动】 fashion 塑造，制作,1
visual,视觉上的,形,ˈvɪʒuəl,The artist's work is known for its strong visual impact.,这位艺术家的作品以强烈的视觉冲击力著称。,,1
outline,论述，概述,名,ˈaʊtlaɪn,The student provided a clear outline for her research proposal.,这位学生为她的研究计划书做了一个清晰的大纲。,【其他—动】勾勒...的轮廓；概述,1
volunteer,志愿者,名,ˌvɒlənˈtɪə,The warm-hearted boy chose to be a volunteer at the local charity.,这位热心男孩选择成为当地慈善机构的一名志愿者。,【其他—动】参加志愿活动,1
promising,有希望的,形,ˈprɒmɪsɪŋ,The promising young artist showed great potential in her early works.,这位前途无量的年轻艺术家在其早期作品中展现出了巨大的潜力。,,1
own,所有，拥有,动,əʊn,The young lady owns a small business.,这位年轻女士经营着一家小企业。,【其他—形】自己的；【固】on one's own,1
celebrity,名人,名,səˈlɛbrəti,The celebrity made a surprise appearance at the charity event.,这位名人在慈善活动上惊喜亮相。,,1
observation,观察，评论,名,ˌɒbzəˈveɪʃᵊn,The scientist made a significant observation that contributed to the research findings.,这位科学家提出了一个重要的观察结果，为研究成果做出了贡献。,【动】observe 观察 ,1
acclaimed,受赞誉的,形,əˈkleɪmd,The acclaimed author released his latest novel.,这位备受赞誉的作家发布了他的最新小说。,,2
boulevard,大街，林荫大道,名,ˈbʊləvɑːd,The famous boulevard was lined with shops and cafes.,这条著名的林荫大道两旁商店和咖啡馆林立。,,2
capability,能力， 性格,名,ˌkeɪpəˈbɪləti,The device's capability exceeded their expectations.,这台设备的性能超出了他们的预期。,【形】capable 有能力的 【固】be capable of doing … 有能力做…,2
academic,学术的,形,ˌækəˈdɛmɪk,The university is known for its strong academic programs.,这所大学以其强大的学术项目而闻名。,【名】academy 学院,2
urgent,紧急的,形,ˈɜːʤᵊnt,It's an urgent matter that calls for immediate attention.,这是一件急事，需要立即处理。,,2
amateur,业余的,形,ˈæmətə,The amateur photographer won a local contest.,这名业余摄影师在当地比赛中获奖。,【其他—名】业余爱好者,2
ease,简单，轻松；舒适，安逸,名,iːz,The agent completed the task with ease.,这名代理轻松地完成了任务。,【其他—动】减轻，缓解,2
graduate,毕业生，研究生,名,ˈɡræʤuət,The graduate received honors upon graduation.,这名毕业生以优异的成绩从大学毕业。,【其他—动】毕业；【名】graduation 毕业,2
equivalent,相等的,名,ɪˈkwɪvᵊlᵊnt,The two products are equivalent in terms of quality and performance.,这两种产品的质量和性能相当。,【名】equivalence 等同,2
relatively,相对而言地,副,ˈrɛlətɪvli,The two concepts are relatively similar in their approach.,这两个概念在方法上比较相似。,,2
enable,使成为可能,动,ɪˈneɪbᵊl,This software enables designers to create realistic 3D models.,这款软件可以让设计师创建逼真的三维模型。,,2
garment,衣服,名,ˈɡɑːmənt,The garment was made from the finest silk.,这件衣服是用最好的丝绸制成的。,【近】apparel 衣服,2
aircraft,飞行器,名,ˈeəkrɑːft,The new aircraft boasts advanced technology and greater fuel efficiency.,这架新型飞机拥有先进的技术和更高的燃油效率。,,2
premier,首位的，一流的,形,ˈprɛmiə,The livehouse will welcome the country's premier rock band.,这家Livehouse将迎来国内首屈一指的摇滚乐队。,【音】AmE /priˈmɪr/；【易混】premiere首映,2
electronics,电子产品,名,ˌɛlɛkˈtrɒnɪks,The store specializes in a wide range of consumer electronics.,这家商店专营各种电子产品。,,2
apparel,衣服,名,əˈpærᵊl,The store offers a wide range of sports apparel.,这家商店售卖各种运动服装。,【近】garment 衣服,2
firm,公司,名,fɜːm,The law firm specializes in corporate cases.,这家律师事务所专门处理公司案件。,【其他—形】坚固的,2
competitive,有竞争力的,形,kəmˈpɛtɪtɪv,The technology company's newly developed product is very competitive in the market.,这家科技公司的新产品在市场上十分有竞争力。,,2
contemporary,当代的,形,kənˈtɛmpᵊrᵊri,The gallery features contemporary art pieces.,这家画廊以当代艺术作品为主。,,2
edge,边缘,名,ɛʤ,The company is on edge of bankcrupcy.,这家公司临近破产边缘。,,2
offer,提供,动,ˈɒfə,The company will offer a discount.,这家公司将提供折扣。,【其他—名】出价，优惠价；（工作/升学机会的）提供,2
manufacture,制造，生产,动,ˌmænjəˈfækʧə,The company will manufacture new smartphones with advanced features.,这家公司将生产具有先进功能的新型智能手机。,【名】manufacturer 制造商,2
publicize,宣传,动,ˈpʌblɪsaɪz,The company aims to publicize the new product widely.,这家公司的目标是广泛宣传新产品。,【名】publicity 宣传,2
advisor,顾问,名,ədˈvaɪzə,There is vacancy for financial advisors open for application in this company.,这家公司的金融顾问岗位正在招聘。,【动】advise 建议,2
process,处理，加工,动,ˈprəʊsɛs,The factory processes raw materials.,这家工厂加工原材料。,,2
reputation,名声，名誉,名,ˌrɛpjəˈteɪʃᵊn,The restaurant has a good reputation for its tasty food.,这家餐厅因其美味佳肴而享有盛誉。,,2
culinary,烹饪的,形,ˈkʌlɪnᵊri,The restaurant is known for its culinary excellence.,这家餐厅以其卓越的厨艺而闻名。,,2
cuisine,料理,名,kwɪˈziːn,The restaurant is famous for its authentic Italian cuisine.,这家餐厅以其正宗的意大利美食而闻名。,,2
eatery,餐饮店，饮食店,名,ˈiːtəri,The local eatery is famous for its homemade pies.,这家本地餐馆以自制馅饼而闻名。,,2
remote,偏僻的,形,rɪˈməʊt,The small village was so remote that it took hours to reach by car.,这个小村庄非常偏僻，开车需要几个小时才能到达。,,2
combine,组合,动,kəmˈbaɪn,This recipe requires you to combine the flour and sugar before adding other ingredients.,这个食谱要求在加入其他配料之前先将面粉和糖混合。,【名】combination,2
challenging,有挑战性的，困难的,形,ˈʧælɪnʤɪŋ,The puzzle was challenging but fun to solve.,这个谜题很有挑战性，但也很有趣。,【动/名】challenge 挑战,2
landmark,地标，里程碑,名,ˈlændmɑːk,The historical building is a landmark in the city.,这个历史建筑是这座城市的地标。,,2
basis,基础,名,ˈbeɪsɪs,The decision was made on the basis of careful research.,这个决定是在仔细研究的基础上做出的。,【动】base 以…为基础,2
common,常见的；共同的,形,ˈkɒmən,The park is a common meeting place for joggers.,这个公园是慢跑者经常聚集的地方。,,2
designate,指定,动,ˈdɛzɪɡneɪt,The quiet area was designated for deep concentration and study.,这个安静的区域是专门用来集中精力学习的。,,2
composition,作文,名,ˌkɒmpəˈzɪʃᵊn,The composition of the painting conveyed a sense of serenity.,这幅画的构图给人一种宁静的感觉。,【其他—动】 compose，意为撰写，组成,2
detailed,详细的,形,ˈdiːteɪld,The report provided a detailed analysis of the market trends.,这份报告对市场趋势进行了详细分析。,【名】detail 细节,2
alike,相似的,形,əˈlaɪk,The twins looked remarkably alike.,这对双胞胎却长得十分相似。,【其他—副】同样地【名】likelyhood 可能性,2
enjoyable,有乐趣的，令人愉快的,形,ɪnˈʤɔɪəbᵊl,The trip to the amusement park was thoroughly enjoyable.,这次游乐园之旅非常愉快。,,2
gathering,聚会，会合,名,ˈɡæðərɪŋ,The family gathering was a joyous occasion for everyone.,这次家庭聚会对每个人来说都是一个欢乐的时刻。,【动】gather 聚集；搜集,2
coincidence,巧合,名,kəʊˈɪnsɪdᵊns,The meeting was a coincidence as they happened to be in the same place at the same time.,这次会面是一个巧合，因为他们碰巧在同一时间出现在同一地点。,,2
conference,会议,名,ˈkɒnfᵊrᵊns,The international conference brought together experts from diverse fields.,这次国际会议汇集了来自不同领域的专家。,【固】 conference call电话会议，press conference 媒体发布会,2
exclusive,独有的，独家的,形,ɪksˈkluːsɪv,The exclusive event attracted celebrities and influencers.,这次独家活动吸引了众多名人和有影响力的人士。,【动】exclude 排除；【反】inclusive 包容的，包含的,2
afford,负担得起，买得起,动,əˈfɔːd,The sale made luxury goods more affordable.,这次促销使奢侈品的价格更加亲民。,【固】afford to do … 能够负担得起做…,2
campaign,（为社会，商业或政治目的进行的一系列有计划的）活动,名,kæmˈpeɪn,The campaign gained momentum quickly.,这次促销活动势头很猛。,,2
appeal,呼吁；具有吸引力；上诉,动,əˈpiːl,The charity event appealed to a wide range of donors.,这次慈善活动吸引了众多捐助者。,【固】 appeal to … 对…有吸引力,2
attract,吸引,动,əˈtrækt,The exhibition attracted thousands of visitors.,这场展览吸引了成千上万的参观者。,【形】attractive 有吸引力的；【名】attraction 旅游胜地,2
superb,极好的,形,suːˈpɜːb,The performance received superb reviews from critics.,这场演出获得了评论界的高度评价。,,2
upcoming,即将到来的,形,ˌʌpˈkʌmɪŋ,The upcoming event is scheduled for next week.,这场即将到来的活动安排在下周。,【近】coming 即将来的,2
category,部门，种类,名,ˈkætəɡᵊri,The novel falls under the category of historical fiction.,这部小说属于历史小说。,,2
premise,房屋建筑及附属用地,名,ˈprɛmɪs,The movie's premise revolves around a thrilling mystery.,这部电影的主题围绕着一个惊心动魄的谜团展开。,【其他词义】前提,2
brochure,小册子， 宣传册,名,ˈbrəʊʃə,The brochure outlined all the tour details.,这本小册子概述了所有的旅游细节。,【音】AmE /brəʊˈʃʊr/,2
content,内容,名,ˈkɒntɛnt,The content of the book is educational and engaging.,这本书的内容寓教于乐，引人入胜。,,2
burden,负担,名,ˈbɜːdᵊn,The responsibility of caring for a pet is a significant burden.,照顾宠物是一项重大的责任。,,2
upstairs,楼上地,副,ˌʌpˈsteəz,Please go upstairs to find the meeting room.,找会议室请上楼。,【其他—形】【音】/ˈʌpsteəz/,2
relief,安心,名,rɪˈliːf,Finding a solution brought a sense of relief to the team.,找到解决方案后，团队如释重负。,,2
flight ,航班,名,flaɪt ,The long-haul flight took passengers across multiple time zones.,长途飞行跨越了多个时区。,【固】catch/take a flight 搭乘飞机， miss a flight 错过飞机,2
correspondent,通讯员,名,ˌkɒrɪˈspɒndənt,The war correspondent reported live from the conflict zone.,战地记者在冲突地区进行现场报道。,,2
showcase,展示,动,ˈʃəʊkeɪs,The exhibition will showcase the latest art pieces.,展览将展示最新的艺术作品。,,2
consult,咨询,动,kənˈsʌlt,It's wise to consult with colleagues before making a decision.,在做决定之前，最好先征求同事的意见。,【名】consultation ,2
screen,筛选,动,skriːn,We need to screen the candidates carefully before making a decision.,在做出决定之前，我们需要认真筛选候选人。,【其他—名】屏幕,2
thoughtfully,周到,副,ˈθɔːtfᵊli,She thoughtfully considered each option before making a decision.,在做出决定之前，她深思熟虑地考虑了每一个方案。,,2
omit,忽略,动,əˈmɪt,Please do not omit any important details when summarizing the report.,在总结报告时，请不要遗漏任何重要细节。,【名】omission 省略，遗漏,2
preliminary,初步的，预备性的,形,prɪˈlɪmɪnᵊri,We completed some preliminary research before the main study.,在主要研究之前，我们完成了一些初步研究。,,3
potential,潜在的,形,pəˈtɛnʃᵊl,His potential leadership skills became evident during the challenging project.,在这个具有挑战性的项目中，他潜在的领导能力显露无遗。,【其他—名】潜力,3
control,控制,动,kənˈtrəʊl,It's important to control expenses to stay within the budget.,在预算范围内控制开支非常重要。,【其他—名】,3
respondent,受访者,名,rɪˈspɒndᵊnt,The majority of respondents in the survey expressed satisfaction with the product.,在一项调查中，大多数受访者对产品表示满意。,【动】respond 回应,3
figure,数字,名,ˈfɪɡə,Use figures and charts to illustrate data in your research presentation.,在研究报告中使用数字和图表说明数据。,【动】figure 认为，描绘,3
equally,同样地,副,ˈiːkwəli,All candidates are treated equally during the selection process.,在选拔过程中，对所有候选人一视同仁。,,3
forum,论坛,名,ˈfɔːrəm,The online forum allows users to discuss various topics.,在线论坛允许用户讨论各种话题。,,3
status,状况，地位,名,ˈsteɪtəs,Check the status of your application online.,在线查看您的申请状态。,,3
perspective,看法,名,pəˈspɛktɪv,Developing a global perspective is crucial in our interconnected world with diverse cultural influences.,在我们这个相互联系、受不同文化影响的世界里，培养全球视野至关重要。,,3
predictable,可预测的,形,prɪˈdɪktəbᵊl,In stable conditions the system's behavior is predictable.,在稳定的条件下，系统的行为是可以预测的。,,3
draft,草稿,名,drɑːft,A draft is necessary before finalizing your essay.,在文章定稿之前，有必要先写好初稿。,,3
observance,遵守,名,əbˈzɜːvᵊns,The observance of safety protocols is crucial in hazardous work environments.,在危险的工作环境中，遵守安全协议至关重要。,,3
compliance,服从，顺从,名,kəmˈplaɪəns,Strict compliance with safety regulations is crucial in hazardous workplaces.,在危险的工作场所，严格遵守安全规定至关重要。,【动】comply 服从,3
glimpse,一瞥,名/动,ɡlɪmps,We caught a glimpse of a rare bird in the forest during the hike.,在徒步旅行中，我们瞥见了森林中的一只珍稀鸟类。,,3
verify,验证，核实,动,ˈvɛrɪfaɪ,She carefully verified the accuracy of her contact information before submitting it.,在提交联系信息之前，她仔细核实了信息的准确性。,【名】verification 验证,3
redesign,重新设计,动,ˌriːdɪˈzaɪn,The team decided to redesign the mobile app after receiving user feedback.,在收到用户反馈后，团队决定重新设计移动应用程序。,,3
résumé,履历书,名,ˈrɛzjʊmeɪ,Check your résumé before applying for the job.,在申请工作之前，请检查一下您的简历。,【易混】resume 继续,3
attach,添付,动,əˈtæʧ,Attach your résumé to the application form.,在申请表上附上您的简历。,【名】attachment 附件,3
priority,优先事项,名,praɪˈɒrəti,Safety should always be a top priority in any workplace.,在任何工作场所，安全始终是重中之重。,【形】prior 在前的，优先的,3
value,重视，珍视,动,ˈvæljuː,People often value honesty in relationships.,在人际交往中，人们往往看重诚实。,【其他—名】价值,3
list,登记；记载；列举,动,lɪst,I'll list essential groceries before going to the supermarket.,在去超市之前，我会列出必备的日用品清单。,【其他—名】列表,3
