Word,Meaning,POS,Phonetic,Example,Translation,Note,Unit
establishment,建立；机构,名,ɪˈstæblɪʃmənt,The establishment of the new library was well received.,新图书馆的建立广受好评。,【动】establish 建立,5
pricing,定价,名,ˈpraɪsɪŋ,The pricing of the new phone is reasonable.,新手机的定价很合理。,【动】price 定价,5
efficient,有效率的,形,ɪˈfɪʃᵊnt,The new software has made our processing more efficient.,新软件提高了我们的处理效率。,【名】efficiency；【易混】effective 有效的,5
introduction,介绍,名,ˌɪntrəˈdʌkʃᵊn,The introduction of the new software improved efficiency in the office.,新软件的引入提高了办公室的效率。,【动】introduce 介绍,5
trial,试行，尝试,名,traɪəl,Trial for the new software begins tomorrow.,新软件的试用从明天开始。,,5
function,机能，功能,名,ˈfʌŋkʃᵊn,The function of the new software simplifies complex calculations.,新软件的功能简化了复杂的计算。,【其他—动】运转，正常工作 【形】 functional 起作用的,5
improvement,改进,名,ɪmˈpruːvmənt,The new software brought significant improvement in efficiency.,新软件大大提高了工作效率。,【动】improve,5
construction,建筑工事，建设,名,kənˈstrʌkʃᵊn,The construction of the new bridge is scheduled to start next month.,新桥计划于下月开工。,【动】construct 建设,5
enterprise,企业，事业,名,ˈɛntəpraɪz,The new enterprise focuses on sustainable farming practices.,新企业专注于可持续农业实践。,,5
predecessor,前身,名,ˈpriːdɪsɛsə,The new smartphone model outperformed its predecessor in terms of features and performance.,新款智能手机在功能和性能方面都优于前代产品。,,5
feature,以...为特色,动,ˈfiːʧə,The new smartphone features a new design.,新款智能手机采用全新设计。,【其他—名】特色,5
track,追踪,动,træk,The newly develpoed application allows you to track your package.,新开发的应用程序允许您追踪您的包裹。,【其他—名】轨迹,5
rental,租金，出租，租用的房屋,名,ˈrɛntᵊl,The newly wed couple is looking for an apartment rental.,新婚夫妇正在找房子。,,5
opening,开始，开店，空缺，空席,名,ˈəʊpnɪŋ,The grand opening of the new store attracted a large crowd.,新店的盛大开业吸引了大批的人。,,5
popularity,人气，流行,名,ˌpɒpjəˈlærəti,The popularity of the new movie spread quickly among viewers.,新电影在观众中迅速走红。,【形】popularity,5
confusing,令人困惑的,形,kənˈfjuːzɪŋ,The new tax laws are quite confusing.,新的税法令人困惑。,【动】confuse 使困惑；【易混】confused 感到困惑的,5
illuminate,照亮,动,ɪˈljuːmɪneɪt,The new streetlights illuminate the neighborhood and provide a safer environment at night.,新的路灯照亮了社区，为夜间提供了更安全的环境。,【名】 illumination 照明,5
gym,健身房，体育馆,名,ʤɪm,The new gym features state-of-the-art fitness equipment.,新的健身房配备了最先进的健身器材。,,5
direct,指示，指导,动,daɪˈrɛkt,The newly arriving employees were directed to refer to employee handbook for orientation information.,新到员工可参阅员工手册，了解入职引导信息。,【其他—形】直接的,5
revise,改正，修正,动,rɪˈvaɪz,Writers often revise their drafts multiple times to improve the content.,写作者通常会多次修改草稿，以完善内容。,【名】revision 修订,5
respectively,分别，各自,副,rɪˈspɛktɪvli,The team members respectively presented their findings in the meeting.,小组成员分别在会上介绍了他们的研究成果。,,5
fragile,易碎易损的,形,ˈfræʤaɪl,Handle the fragile items with care.,小心处理易碎物品。,,5
misplace,随意搁置，一时乱放而找不到,动,ˌmɪsˈpleɪs,Be careful not to misplace your keys.,小心别把钥匙放错地方。,,5
sharp,尖锐的，敏锐的，精明的,形,ʃɑːp,Be careful; the knife is sharp and should be handled with caution.,小心；刀很锋利，应谨慎操作。,,5
brick,砖块,名,brɪk,The path was lined with red brick.,小路两旁铺满了红砖。,,5
salesperson,贩卖员,名,ˈseɪlzˌpɜːsᵊn,The salesperson assisted customers with their purchases.,销售员协助顾客购物。,,5
media,媒体,名,ˈmiːdiə,The news spread through various media channels.,消息通过各种媒体渠道传播开来。,,5
durable,耐用的,形,ˈdjʊərəbᵊl,Consumers prefer durable goods that last longer.,消费者更喜欢使用寿命更长的耐用品。,,5
consumer,消费者,名,kənˈsjuːmə,Consumer feedback indicated a preference for eco-friendly packaging.,消费者反馈表明，他们更青睐环保包装。,【动】consume消耗,5
once,一旦,连,wʌns,We can move on to the next phase once the project is completed.,项目完成后，我们就可以进入下一阶段。,【副】一次；曾经,5
checklist,清单，检查表,名,ˈʧɛklɪst,The project manager created a detailed checklist to track progress.,项目经理制定了一份详细的清单来跟踪进度。,,6
previous,之前的，以往的,形,ˈpriːviəs,The project manager briefed the content in the previous meeting.,项目经理在之前的会议上简要介绍了内容。,,6
result,产生...的结果/后果,动,rɪˈzʌlt,The successful completion of the project was a positive result for the team.,项目的顺利完成为团队带来了积极的成果。,【固】result in 导致，造成,6
deadline,截止期限,名,ˈdɛdlaɪn,The project's deadline was set for the end of the month.,项目的截止日期定在本月底。,,6
pamphlet,小册子,名,ˈpæmflɪt,Informative pamphlets detail new product features and help customers make informed decisions.,翔实的小册子详细介绍了新产品的特点，帮助客户做出明智的决定。,,6
inquire,问询,动,ɪnˈkwaɪə,Please inquire at the reception desk for further information.,详情请咨询前台。,,6
corresponding,相应的,形,ˌkɒrɪsˈpɒndɪŋ,The corresponding data sets revealed a consistent pattern of improvement over time.,相应的数据集显示，随着时间的推移，情况在不断改善。,,6
restriction,限制,名,rɪˈstrɪkʃᵊn,The restriction on parking in certain areas aims to improve traffic flow.,限制在某些区域停车的目的是改善交通流量。,,6
facilitate,促进,动,fəˈsɪlɪteɪt,Modern software helps facilitate efficient project management.,现代软件有助于提高项目管理效率。,【形】facilitative 有促进作用的,6
detect,探测,动,dɪˈtɛkt,Modern technology helps detect potential issues before they become major problems.,现代技术有助于在潜在问题变成重大问题之前发现它们。,【名】detection 探测  detective 侦探,6
obvious,明显的,形,ˈɒbviəs,It's obvious that proper planning is key to the success of any project.,显而易见，合理规划是任何项目成功的关键。,,6
leisure,闲暇,名,ˈlɛʒə,During his leisure time he enjoys reading books and exploring nature.,闲暇时，他喜欢阅读书籍和探索大自然。,,6
laundry,洗衣服，洗衣房,名,ˈlɔːndri,The laundry is done every weekend.,洗衣服是在每周末进行的。,,6
dishwasher,洗碗机,名,ˈdɪʃˌwɒʃə,The dishwasher makes kitchen cleanup easier.,洗碗机让厨房的清洁变得更加容易。,,6
hopefully,有希望地，可以指望地,副,ˈhəʊpfᵊli,Hopefully the weather will be sunny for the picnic.,希望野餐时天气晴朗。,,6
hardware,硬件，五金制品,名,ˈhɑːdweə,The hardware store had everything needed for the home repairs.,五金店里有家庭维修所需的一切物品。,【反】software 软件,6
wireless,无线的,形,ˈwaɪələs,The wireless connection allows easy internet access.,无线的网络连接能使上网十分简单。,,6
whether,是否，是...还是...， 无论,连,ˈwɛðə,I'll attend the meeting whether it's in person or virtual.,无论是亲自参加还是虚拟会议，我都会参加。,,6
lately,最近,副,ˈleɪtli,I've been busy with work lately.,我最近工作很忙。,,6
sincerely,真诚地,副,sɪnˈsɪəli,I sincerely wish you good fortune.,我衷心祝愿您好运。,【形】sincere 真诚的,6
appreciate,欣赏，感谢,动,əˈpriːʃieɪt,I really appreciate your help with the move.,我真的很感谢您帮助我搬家。,【名】appreciation,6
aerobics,有氧运动,名,əˈrəʊbɪks,I have an aerobics class scheduled for the night.,我约了今晚的有氧运动课。,,6
photograph,照片,名,ˈfəʊtəɡrɑːf,I'll take a photograph to capture the beautiful sunset.,我要拍一张照片记录下美丽的日落。,【动】摄影,6
prepare,准备,动,prɪˈpeə,I need time to prepare for the upcoming exam.,我需要时间准备即将到来的考试。,,6
update,更新,动,ʌpˈdeɪt,I need to update my computer software to access the latest security enhancements.,我需要更新我的电脑软件，以获得最新的安全增强功能。,【其他—名】,6
owe,欠,动,əʊ,I recognize the debt of gratitude I owe my mentors for shaping my career path.,我认识到我欠导师们很多，是他们塑造了我的职业道路。,,6
pharmacy,药店,名,ˈfɑːməsi,I went to the pharmacy to pick up my prescription.,我去药房取处方药。,【形】pharmaceutical 制药的,6
subscription,定期订阅,名,səbˈskrɪpʃᵊn,I canceled my magazine subscription.,我取消了杂志订阅。,,6
occasionally,偶尔地，有时候,副,əˈkeɪʒnəli,I occasionally treat myself to a favorite meal.,我偶尔会请自己吃一顿喜欢的饭菜。,【名】occasion 地点；【形】occasional 偶尔的,6
view,查看，观看,动,vjuː,We'd better find a comfortable spot to view the scenic landscape.,我们最好找个舒适的地方欣赏风景。,【其他—名】景色；视角；视野,6
directly,直接地,副,daɪˈrɛktli,The feedback was given directly to ensure clarity.,我们直接给出了反馈意见，以确保清晰明了。,,6
lobby,大厅，大堂,名,ˈlɒbi,We waited in the hotel lobby for our friends.,我们在酒店大堂等待我们的朋友。,,6
treat,对待；款待,动,triːt,We should treat others with kindness and respect.,我们应该善待他人，尊重他人。,【其他—名】款待；请客,6
locate,定位，找出…的准确位置,动,ləʊˈkeɪt,We need to locate the missing keys.,我们需要找到丢失的钥匙。,【名】location 地点,6
meet,满足，迎接，遇见,动,miːt,Let's meet at the café at 3 PM for our discussion.,我们下午 3 点在咖啡厅见面讨论吧。,,6
market,推销，促销,动,ˈmɑːkɪt,Our team plans to market the new product globally to reach a wider audience.,我们团队计划在全球范围内推广新产品，让更多的人使用。,【其他—名】市场,6
sweep,扫除,动,swiːp,We usually sweep the floor and keep it clean before New Year's Day.,我们通常会在元旦前把地打扫干净。,,6
welcome,欢迎的，令人愉快的,形,ˈwɛlkəm,You are always welcome to join us.,我们随时欢迎您的加入。,,6
clear,清除，搬走,动,klɪə,We cleared the snow away from the doorstep,我们扫掉了门口台阶上的积雪。,【形】清晰的；干净的,6
later,后来，以后,副,ˈleɪtə,We can discuss it later.,我们可以稍后再讨论。,,6
stay,滞留,名,steɪ,We plan to stay at the hotel for a week.,我们计划在酒店住一个星期。,【其他—动】停留,6
launch,新产品发布，发行，发射,动,lɔːnʧ,We will launch the updated website next week.,我们即将推出更新的网站。,【其他—名】；【近】release 发布；披露,6
fortunate,幸运的,形,ˈfɔːʧᵊnət,We were fortunate to receive funding for our project.,我们很幸运地获得了项目资金。,【反】unfortunate 不幸的,6
permanent,永久的，恒久的,形,ˈpɜːmənənt,No permanent position can be guaranteed at our company.,我们公司不能保证长期职位。,,6
express,表示,动,ɪkˈsprɛs,We would like to express our most sincere apology for recalling the defective car models.,我们对召回有缺陷的车型表示最诚挚的歉意。,【其他—名】快递；特快（列车等）,6
inconvenience,不便,名,ˌɪnkənˈviːniəns,We apologize for any inconvenience caused by the delay.,我们对延误造成的不便深表歉意。,,6
extensive,广泛的，大量的,形,ɪkˈstɛnsɪv,An extensive search was conducted for the missing documents.,我们对丢失的文件进行了广泛搜索。,,6
import,进口,动,ˈɪmpɔːt,We regularly import exotic fruits from tropical countries to diversify our local grocery stores.,我们定期从热带国家进口外来水果，以丰富本地杂货店的品种。,【反】出口 export,6
manufacturer,制造业者,名,ˌmænjəˈfækʧᵊrə,Our manufacturer specializes in producing high-quality electronics.,我们的制造商专门生产高质量的电子产品。,,6
quantity,数量，量,名,ˈkwɒntəti,We need a large quantity of paper for the project.,我们的项目需要大量的纸张。,【易混】quality 质,6
mission,使命,名,ˈmɪʃᵊn,Our team is on a mission to improve community well-being through education and healthcare.,我们的团队肩负着通过教育和医疗保健改善社区福祉的使命。,,6
deal,处理，对应,动,diːl,It is necessary that we deal with emergent issues in a timely manner.,我们必须及时处理突发问题。,【固】deal with … 处理…,6
urge,敦促,动,ɜːʤ,I urge you to consider the importance of regular exercise.,我建议您考虑定期锻炼的重要性。,【其他—名】冲动,6
recommend,推荐,动,ˌrɛkəˈmɛnd,I recommend trying the new café; the coffee and pastries are excellent.,我建议大家尝试一下新开的咖啡厅；那里的咖啡和糕点都非常棒。,【名】 referee 推荐人 reference 参考,6
post,发布，张贴；邮寄,动,pəʊst,I'll post pictures on social media to share the experience.,我会在社交媒体上发布照片，分享这次经历。,【其他—名】岗位,6
personally,个人而言地,副,ˈpɜːsᵊnᵊli,I will handle the matter personally.,我会亲自处理此事。,,6
monitor,监视，监控，检查,动,ˈmɒnɪtə,I will monitor the progress of the project closely to ensure it stays on track.,我会密切关注项目的进展情况，确保其按计划进行。,【其他—名】显示器；监控,6
participate,参加,动,pɑːˈtɪsɪpeɪt,I'm excited to participate in the upcoming community event.,我很高兴能参加即将到来的社区活动。,【名】participation 参与；【名】participant 参与者,6
seat,座位,名,siːt,I prefer an aisle seat for more legroom during flights.,我更喜欢过道座位，这样在飞行时腿部空间更大。,【其他—动】落座,6
tolerate,容忍，对...有耐受性,动,ˈtɒləreɪt,I find it challenging to tolerate excessive noise while working.,我发现在工作时忍受过大的噪音是一项挑战。,【名】tolerance 耐受性,6
forward,转发,动,ˈfɔːwəd,My emails were forwarded to a friend.,我的邮件被转发给了一位朋友。,【其他—副】向前地,6
ceiling,天花板，上限,名,ˈsiːlɪŋ,I painted the ceiling of my room a calming shade of blue.,我把房间的天花板刷成了令人平静的蓝色。,【易混】railing 扶手,6
recurrence,再次发生，循环,名,rɪˈkʌrəns,The recurrence of the issue indicates a deeper problem that needs addressing.,问题的反复出现表明有更深层次的问题需要解决。,,6
complex,复杂的，复合的,形,ˈkɒmplɛks,The problem was more complex than initially thought.,问题比最初想象的要复杂。,【名】complexity 复杂，复杂性,6
compensation,补偿，赔偿金,名,ˌkɒmpɛnˈseɪʃᵊn,Adequate compensation was provided to employees affected by the restructuring.,为受重组影响的员工提供了适当的补偿。,【动】compensate 弥补，抵消 【近】 reimburse， offset,7
ensure,保证，确保,动,ɪnˈʃʊə,Safety procedures are in place to ensure everyone's well-being.,为确保每个人的安全，制定了安全程序。,,7
packaging,包装,名,ˈpækɪʤɪŋ,Businesses are adopting eco-friendly packaging solutions to reduce their impact due to environmental concerns.,为了应对环境问题，企业正在采用环保包装解决方案，以减少对环境的影响。,,7
reach,抵达，达成,动,riːʧ,You need to set realistic and achievable targets to reach your goals.,为了实现自己的目标，要制定切实可行的目标。,,7
obtain,取得,动,əbˈteɪn,He worked hard to obtain a scholarship for his college education.,为了取得奖学金用来上大学，他非常努力。,,7
rider,骑手,名,ˈraɪdə,The rider wore a helmet for safety while cycling.,为了骑车安全，骑手配戴了头盔。,,7
crew,全体工作人员，全体乘务人员,名,kruː,The film crew worked tirelessly to capture the perfect shot.,为了拍摄到完美的镜头，摄制组不知疲倦地工作着。,,7
lock,上锁,动,lɒk,Remember to lock the door before leaving for added security.,为了能更加安全，离开前记得锁门。,,7
retain,保持， 保留,动,rɪˈteɪn,It's essential to retain key employees for the company's long-term success.,为了公司的长期成功，留住关键员工至关重要。,,7
overnight,通宵，隔夜，整夜,副,ˌəʊvəˈnaɪt,She completed the project overnight to meet the deadline.,为了赶工期，她连夜完成了项目。,【其他—形】,7
competitor,竞争对手,名,kəmˈpɛtɪtə, businesses need to understand their competitor's strategies to stay competitive.,为了保持竞争力，企业需要了解竞争对手的战略。,,7
rephrase,改写,动,ˌriːˈfreɪz,It's important to rephrase information in your own words to avoid plagiarism.,为避免抄袭，重要的是用自己的话重新表述信息。,,7
security,保护，安全,名,sɪˈkjʊərəti,Security measures were implemented to protect the building.,为保护大楼采取了安全措施。,【形】secure 安全的,7
panel,仪表盘，面板，专家咨询组,名,ˈpænᵊl,The panel discussed future plans for the community.,委员会讨论了社区的未来计划。,,7
approve,批准，赞成,动,əˈpruːv,The committee approved the new policy.,委员会批准了新政策。,【名】approval,7
committee,委员会,名,kəˈmɪti,The committee will meet next week to discuss upcoming events and initiatives.,委员会将于下周召开会议，讨论即将开展的活动和举措。,,7
fine,罚金,名,faɪn,Paying a fine is the consequence for breaking rules.,违反规则的后果就是罚款。,,7
trouble,故障，困难,名,ˈtrʌbᵊl,Website breakdown posed a trouble for loyal viewers.,网站故障给顾客们带来了麻烦。,【固】have trouble/difficulty (in) doing 做某事有麻烦/困难,7
payment,支付,名,ˈpeɪmənt,The online payment for the purchase was quick and secure.,网上购物付款快捷安全。,,7
tournament,锦标赛，联赛,名,ˈtʊənəmənt,The tennis tournament attracts players from around the world.,网球锦标赛吸引了来自世界各地的选手。,,7
duty,职责， 义务,名,ˈdjuːti,It's his duty to complete the assigned tasks.,完成指定任务是他的职责。,,7
questionnaire,问卷调查,名,ˌkwɛstʃəˈnɛː,Complete the questionnaire to share your opinions.,完成问卷，分享您的观点。,,7
entitle,权利,动,ɪnˈtaɪtᵊl,Completing the required training will entitle you to a professional certification.,完成规定的培训后，您将有权获得专业认证。,【名】entitlement 权利,7
retirement,退休,名,rɪˈtaɪəmənt,Planning for retirement involves financial preparation.,退休计划涉及财务上的准备。,【动】retire,7
cooperation,合作,名,kəʊˌɒpᵊrˈeɪʃᵊn,Cooperation between teams is crucial for success.,团队之间的合作是成功的关键。,【动】cooperate；【形】cooperative 合作的；配合的,7
commend,表彰，赞扬,动,kəˈmɛnd,The team would like to commend the employee for exceptional dedication and hard work.,团队要对该员工的卓越奉献和辛勤工作表示赞赏。,【易混】command 控制，命令 【易混】comment 评论,7
timeline,日程表，时间轴,名,ˈtaɪmˌlaɪn,The team needs a timeline to organize the sequence of events.,团队需要一个时间轴来安排事件的先后顺序。,,7
objective,客观的,名,əbˈʤɛktɪv,The team set clear objectives for the project to ensure success.,团队为项目制定了明确的目标，以确保成功。,,7
equipment,器具，设备,名,ɪˈkwɪpmənt,The team used advanced equipment to conduct the research.,团队使用先进设备开展研究。,【动】【固】be equipped with … 装备有…,7
resolve,解决,动,rɪˈzɒlv,The team worked together to resolve the issue and meet the deadline.,团队齐心协力解决了问题，并在截止日期前完成了任务。,,7
coordinate,协调,动,kəʊˈɔːdɪneɪt,The team worked hard to coordinate the event smoothly.,团队努力协调，使活动顺利进行。,【名】coordination,7
finalize,最后确定,动,ˈfaɪnəlaɪz,The team worked hard to finalize the report.,团队努力地完成报告。,,7
brainstorm,头脑风暴,动,ˈbreɪnstɔːm,The team will brainstorm tomorrow to generate innovative ideas for the new project.,团队明天将进行头脑风暴，为新项目提出创新想法。,【其他—名】,7
report,报告，报道,动,rɪˈpɔːt,The team will compile a detailed report on the project's progress for the stakeholders.,团队将为利益相关者编写一份详细的项目进度报告。,,7
minor,较小的，次要的,形,ˈmaɪnə,The minor issue was quickly resolved by the team.,团队很快就解决了这个小问题。,【名】minority 少数；【反】major 主要的,7
overall,总体上，全体上的,形,ˈəʊvərɔːl,The team's overall performance was commendable.,团队的整体表现值得称赞。,,7
tentatively,试验性地，暂时地,副,ˈtɛntətɪvli,The team tentatively agreed on a date for the next meeting.,团队初步商定了下次会议的日期。,,7
knowledgeable,博学的，有见识的,形,ˈnɒlɪʤəbᵊl,The librarian is knowledgeable about various subjects.,图书管理员对各学科都很了解。,【名】knowledge 知识,7
reference,参考，参照推荐信,名,ˈrɛfᵊrᵊns,The librarian assisted me with finding a helpful reference book.,图书管理员帮助我找到了一本有用的参考书。,【动】refer 参考,7
librarian,图书管理员,名,laɪˈbreəriən,The librarian helps visitors find books in the library.,图书管理员帮助访客在图书馆查找书籍。,,7
access,进入（可以接触到）,名,ˈæksɛs,The library offers easy access to a wide range of books.,图书馆提供了查阅各种书籍的便利条件。,【固】access to… 可获取…；【其他—动】,7
catalog,目录,名,ˈkætəlɒɡ,The library catalog makes it easy to locate books on specific topics.,图书馆目录可以方便地查找特定主题的书籍。,,7
stock,库存，股票,名,stɒk,Investors monitor stock prices on a daily basis.,投资者每天都会关注股票价格。,,7
colleague,同事,名,ˈkɒliːɡ,The colleague provided valuable insights during the team meeting.,同事在团队会议上提出了宝贵的见解。,,7
distinguish,区分,动,dɪsˈtɪŋɡwɪʃ,Distinguish yourself by showcasing unique skills and accomplishments.,通过展示独特的技能和成就使自己与众不同。,【名】distinction 差别,7
license,执照,名,ˈlaɪsᵊns,She obtained her driver's license after passing the driving test.,通过驾驶考试后，她获得了驾照。,,7
persistent,执着的,形,pəˈsɪstᵊnt,She overcame setbacks and achieved her goals through persistent efforts and a positive mindset,通过不懈的努力和积极的心态，她战胜了挫折，实现了自己的目标。,,7
generator,发电机,名,ˈʤɛnəreɪtə,The generator provided electricity to keep essential appliances running during the power failure.,停电期间，发电机提供了电力，保证了必要电器的运转。,【动】generate 生成，产出,7
outage,中断,名,ˈaʊtɪʤ,The power outage disrupted daily activities in the neighborhood.,停电打乱了附近居民的日常活动。,【固】power outage 停电,7
railway,铁道，铁道公司,名,ˈreɪlweɪ,The railway network connects cities efficiently.,铁路网将城市高效地连接起来。,,7
forecast,预测,名,ˈfɔːkɑːst,The weather forecast predicts rain tomorrow.,天气预报说明天会下雨。,,7
therefore,所以,副,ˈðeəfɔː,The weather forecast predicted rain; therefore， it was advisable to bring an umbrella.,天气预报说会下雨，因此建议大家带伞。,,7
facility,设施,名,fəˈsɪləti,The sports facility includes a gym and swimming pool.,体育设施包括健身房和游泳池。,,7
capacity,容量，生产能力，功率,名,kəˈpæsəti,The stadium has a capacity of 50000 people.,体育场可容纳50000人。,,7
considerate,周到的,形,kənˈsɪdərɪt,Being considerate of others' feelings promotes a positive social environment.,体谅他人的感受能促进积极的社会环境。,,7
registration,登陆，注册,名,ˌrɛʤɪˈstreɪʃᵊn,Early registration ensures a spot in the popular workshop.,提早报名能确保可以参加这个受欢迎的研讨会。,【动】register 注册,7
